"uid","asin","title","stars","reviews","price","category","isBestSeller","boughtInLastMonth"
294756,"B07Z8SRFPX","Pagosa Indestructible Hardshell Expandable Spinner Luggage, Navy, 2 Piece Set",4.5,2834,146.76,"Luggage","False",50
294757,"B0CCXYY3G8","Luggage Sets,3 Piece Suitcase Set Carry On Luggage with Spinner Wheels,Hardside PP Durable Luggage with TSA Lock",4.4,20,165.98,"Luggage","False",0
294758,"B0BNJGZYGS","Luggage PC+ABS Durable Expandable Hardside Suitcase with Double Spinner Wheels TSA Lock 28-Inch, Wine Red",4.6,467,129.99,"Luggage","False",0
294759,"B0B7KDHCBT","Checked Luggage 24 inch,Medium Luggage with 8 Spinner Wheels,PC Lightweight Hardside Luggage,Travel Suitcase with Bread Design,TSA Lock,Brown,Checked-Medium 24-Inch,60L",4.5,222,159.99,"Luggage","False",0
294760,"B01M0A3BKH","Freeform Hardside Expandable with Double Spinner Wheels, Carry-On 21-Inch, Black",4.6,10643,148.49,"Luggage","False",2000
294761,"B014TMV5YE","Sion Softside Expandable Roller Luggage, Black, Checked-Large 29-Inch",4.5,15399,139.99,"Luggage","True",2000
294762,"B07RS4PK3J","Expandable Midtown Hardside 4-Piece Luggage Travel Set, Rose Gold",4.3,16518,112.34,"Luggage","False",2000
294763,"B0787DL55W","Chicago Hardside Expandable Spinner Luggages, Teal, 20"" Carry-On",4.3,27142,47.35,"Luggage","True",4000
294764,"B07XSBGH1G","Platinum Elite Softside Expandable Carry on Luggage, 8 Wheel Spinner Suitcase, USB Port, Suiter, Men and Women, True Navy Blue, Carry On 21-Inch",4.6,3846,313.99,"Luggage","False",600
294765,"B0BHDGZXW5","Luggage 3 Piece Set Suitcase Spinner Hardshell Lightweight TSA Lock",4.7,25973,169.99,"Luggage","False",1000
294766,"B071VG5N9D","20-Inch Hardside Spinner, Black",4.6,41646,88,"Luggage","False",1000
294767,"B07BL7JXHV","Maxlite 5 Softside Expandable Luggage with 4 Spinner Wheels, Lightweight Suitcase, Men and Women, Black, Carry-On 21-Inch",4.5,10440,144.49,"Luggage","False",1000
294768,"B013WFNNZI","Omni PC Hardside Expandable Luggage with Spinner Wheels, Carry-On 20-Inch, Black",4.5,23914,114.74,"Luggage","False",1000
294769,"B0BN5G6SM7","Suitcase Set 3 Piece Carry On Hardside Luggage with TSA Lock Spinner Wheels (White, S(20in))",4.6,1137,109.99,"Luggage","False",1000
294770,"B07H8SWKPC","Underseat Carry-On Spinner with USB Port, Purple, One Size",4.5,5725,85.3,"Luggage","False",1000
294771,"B08BX83MDZ","Omni 2 Hardside Expandable Luggage with Spinner Wheels, 3-Piece Set (20/24/28), Nova Teal",4.5,4831,291.1,"Luggage","False",500
294772,"B0B7L8V51M","Luggage Sets Clearance ABS Hardshell 3pcs Luggage Hardside Lightweight Durable Suitcase sets Spinner Wheels Suitcase with TSA Lock (Champage)",4.4,2679,179.99,"Luggage","False",0
294773,"B0CCDPD7WW","Trunk Spinner Luggage Sets 3 Piece (20/25/29)"" PP Hardside Luggage with Double Spinner Wheels, Lightweight Travel Suitcase Set with TSA Lock Upgraded Burst Resistant Zipper, Rose Gold",4.8,8,209.99,"Luggage","False",0
294774,"B0BJ2BPX67","Luggage Sets 4-Piece (16/20/24/28)"" Expandable Suitcases with Wheels PC+ABS Durable Hardside Luggage Clearance OliveGreen",4.4,355,209.99,"Luggage","False",0
294775,"B003SN5VR8","Amsterdam Expandable Rolling Upright Luggage, Gray, 8-Piece Set",4.2,19775,145.83,"Luggage","False",50
294776,"B09Y2DBZGS","Spinners, Black, 22-inch Baseline Essential Carry-On",4.5,241,699,"Luggage","False",100
294777,"B07GDLCQXV","Luggage Sets Expandable PC+ABS Durable Suitcase Double Wheels TSA Lock Blue",4.5,19918,169.99,"Luggage","False",1000
294778,"B07KVMDRNR","Smart Luggage Cup Holder and USB Port, Navy Blue, 2 Piece Set",4.4,11497,53.99,"Luggage","False",2000
294779,"B00503FUNE","Fashion Softside Upright Luggage Set, Expandable, Black, 2-Piece (14/19)",4.3,63678,33.99,"Luggage","False",3000
294780,"B07N3DTN73","Pop Max Softside Luggage with Spinner Wheels, Teal, 3-Piece Set (21/25/29)",4.4,2020,145,"Luggage","False",400
294781,"B07QW9LMRT","Crew Versapack Softside Expandable 8 Spinner Wheel Luggage, USB Port, Men and Women, Jet Black, Carry on 21-Inch",4.7,1306,229.49,"Luggage","False",400
294782,"B07Q1G9ZPG","Expandable Suitcase PC ABS TSA Luggage 3 Piece Set Lock Spinner Carry on (Teal blue)",4.7,5718,189.99,"Luggage","False",500
294783,"B07FD5MLVB","Convertible Garment Bag with Shoulder Strap, Modoker Carry on Garment Duffel Bag for Men Women - 2 in 1 Hanging Suitcase Suit Travel Bags",4.5,9224,43.99,"Luggage","False",2000
294784,"B0116JXRU8","Suit Carry On Garment Bag for Travel & Business Trips With Shoulder Strap and Rolling Luggage Attachment Point - Black",4.6,9424,59.75,"Luggage","False",1000
294785,"B084T5HMK5","7895 Premium Rolling Garment Bag, Bonus Hanging Feature, Men's and Women's, Carry-on Luggage - Grey Heather",3.9,177,199.99,"Luggage","False",400
294786,"B07QMYLN4J","Stratum XLT Expandable Hardside Luggage with Spinner Wheels, Pink Blush, Checked-Large 28-Inch",4.5,6017,100.98,"Luggage","False",800
294787,"B07V49W6NK","Simple Houseware 43-Inch Heavy Duty Garment Bag w/Pocket for Dresses, Coats",4.3,21563,15.97,"Luggage","True",5000
294788,"B0BTBJKBRJ","2 in 1 Waxed Canvas Leather Suit Luggage Garment Bag with Shoulder Strap for Travel and Business Trips",5,1,124.99,"Luggage","False",0
294789,"B0CBH83L9D","Luggage Sets 3 Piece Suitcases Set ABS Expandable 8 Wheels Spinner Suitcase, TSA Lock Travel Luggage For Man And Women (Black Brown)",4.4,22,155.99,"Luggage","False",0
294790,"B0BRJ1B9W7","Luggage Sets Lightweight Durable Suitcase Double Wheels TSA Lock 3-Piece Set (20/24/28), yellow",4.6,627,153.99,"Luggage","False",0
294791,"B0CDXFCFW8","Luggage Expandable Suitcases With Wheels, Hardside Lightweight Carry-on Luggage 20 inch",4.5,704,98.99,"Luggage","False",0
294792,"B0BXCPZD4C","Luggage Set 4 Piece Luggage Set ABS hardshell TSA Lock Spinner Wheels Luggage Carry on Suitcase (BLACK-BROWN, 6 piece set)",4.7,809,209.99,"Luggage","False",400
294793,"B07K6DKPTS","MATEIN Garment Bag for Travel, Large Carry on Garment Bags with Strap for Business, Waterproof Hanging Suit Luggage Bag for Men Women, Wrinkle Free Suitcase Cover for Shirts Dresses Coats, Black",4.5,2662,45.99,"Luggage","False",2000
294794,"B0C4KFDVF8","Suitcase Set 3 Piece Luggage Set Carry On Travel Luggage TSA Lock Spinner Wheels Hardshell Lightweight Luggage Set(White, 5 piece set)",4.6,397,199.99,"Luggage","False",300
294795,"B083PX1TDL","Grace EXT Carry On Luggage Airline Approved, 20” Expandable Hardside Carry On Suitcase With Wheels, ABS+PC Harshell Spinner Small Luggage with TSA Lock - Blue, 20-Inch Carry-On",4.6,4603,139.99,"Luggage","False",600
294796,"B0BRMZGR9H","Carry On Underseat Multi-functional, 16-inch Underseater Lightweight Overnight Suitcase for Men Women, Black",4.6,741,89.99,"Luggage","False",900
294797,"B01DJLKZBA","Winfield 2 Hardside Expandable Luggage with Spinner Wheels, Checked-Large 28-Inch, Deep Blue",4.5,20483,174.99,"Luggage","False",400
294798,"B07CVKHYR5","Luggage Expandable(only 28"") Suitcase PC+ABS Spinner Built-In TSA lock 20in 24in 28in Carry on (Charcoal., L(28in).)",4.5,13733,119.99,"Luggage","False",600
294799,"B0762VC1XB","Smart Under Seat Carry-On Luggage with USB Charging Port, Black, Underseater 15-Inch",4.6,8159,58.1,"Luggage","False",1000
294800,"B07LFS3LTH","Luggage Expandable(only 28"") Suitcase PC+ABS Spinner 20in 24in 28in Carry on (white grid new, S(20in)_carry on)",4.6,10630,59.99,"Luggage","False",1000
294801,"B07PLKWGTZ","Solyte DLX Softside Expandable Luggage with Spinner Wheels, Midnight Black, Carry-On 20-Inch",4.5,2405,149.85,"Luggage","False",400
294802,"B0BQ3DHV28","Aluminium Frame Hardside Expandable Spinner Wheel Luggage, Built-In TSA lock Carry on Suitcase, with Cup Holder & Phone Holder - - in 18in/20in/24in Sizes",3.8,60,189.99,"Luggage","False",300
294803,"B07MXF4G8K","Hard Shell Carry on Luggage Airline Approved, Carry on Suitcases with Wheels, Lightweight PC Luminous Textured Travel Luggage, TSA Approved, 20 Inch Small Carry-On, Black",4.5,1686,169.99,"Luggage","False",400
294804,"B07DC1DB23","London Hardside Spinner Wheel Luggage, Mint, Carry-On 20-Inch",4.5,10968,53.63,"Luggage","False",1000
294805,"B07BLCB6DS","Maxlite 5 Softside Expandable Upright 2 Wheel Luggage, Lightweight Suitcase, Men and Women, Black, Carry-On 22-Inch",4.5,4246,144.49,"Luggage","False",400
294806,"B07YNKH8BZ","20"" Spinner Carry-On Luggage, Black",4.5,4183,40,"Luggage","False",1000
294807,"B01N0DG6Z5","Platinum Elite Softside Expandable Carry on Luggage, 2 Wheel Upright Suitcase, USB Port, Men and Women, Shadow Black, Carry On 22-Inch",4.3,839,314.49,"Luggage","False",200
294808,"B074VBV39F","Centric Hardside Expandable Luggage with Spinner Wheels, Black, Checked-Large 28-Inch",4.5,6048,169.99,"Luggage","False",300
294809,"B07H515VCZ","Maxporter II 30"" Hardside Spinner Trunk Luggage, Expandable, Navy",4.5,958,299.99,"Luggage","False",100
294810,"B01MQDRPN1","7895 Premium Rolling Garment Bag, Bonus Hanging Feature, Men's and Women's, Carry-on Luggage - Black",4.5,988,149.99,"Luggage","False",100
294811,"B07Z8SCGLJ","Pagosa Indestructible Hardshell Expandable Spinner Luggage, Black, 2 Piece Set",4.5,2834,138.99,"Luggage","False",300
294812,"B00CBT5ISC","Journey Softside Upright Luggage Set,Expandable, Blue, 4-Piece (14/19/24/28)",4.1,7542,85.99,"Luggage","False",500
294813,"B07CGBK1G4","Luggage Expandable Suitcase PC+ABS 3 Piece Set with TSA Lock Spinner 20in24in28in",4.6,9472,169.99,"Luggage","False",400
294814,"B07QK971DN","Carry-on Garment Bag Large Duffel Bag Suit Travel Bag Weekend Bag Flight Bag with Shoe Pouch for Men Women (Black) Age: Over 6 Years Old",4.3,2775,43.98,"Luggage","False",1000
294815,"B0B9K44XTS","Luggage Sets Expandable Lightweight Suitcases with Wheels PC+ABS Durable Travel Luggage TSA Lock Navy Blue 4pcs",4.4,355,209.99,"Luggage","False",200
294820,"B06XVSR3JZ","Luggage 4 Piece Set Suitcase Spinner TSA Lock Softshell lightweight (blue+sliver)",4.5,5187,169.99,"Luggage","False",300
294821,"B07BKKDNDQ","Maxlite 5 Softside Lightweight Carry-On Upright 2 Wheel Rolling Garment Bag, Men and Women, Black, 22-Inch",4.4,547,186.99,"Luggage","False",200
294822,"B01M7NTLPB","Buckingham 44-Inch Wheeled Garment Bag, Black",4.3,1346,196.07,"Luggage","False",200
294823,"B09Y282JQD","Uprights, Black, 22-inch Baseline Essential Carry-On",4.4,62,659,"Luggage","False",50
294824,"B07MX5HQHP","Alpha 3 Extended Trip 4-Wheeled Garment Bag with TSA Lock - Stores Suits, Coats, Dresses, and Shoes - Black",4.8,14,1350,"Luggage","False",0
294825,"B00BL9XB28","Melbourne Hardside Expandable Spinner Wheel Luggage, Blue, Carry-On 20-Inch",4.5,3701,59.99,"Luggage","False",2000
294826,"B01HIATG6I","Chatelet Hard+ Hardside Luggage with Spinner Wheels, Champagne White, Checked-Large 28 Inch, with Brake",4.6,2537,259.6,"Luggage","False",100
294827,"B015DC2ST0","Melbourne Hardside Expandable Spinner Wheel Luggage, Charcoal, 2-Piece Set (20/28)",4.4,2865,119.99,"Luggage","False",800
294828,"B07QXD3J9G","Crew Versapack Softside Expandable 8 Spinner Wheel Luggage, USB Port, Men and Women, Jet Black, Carry on 20-Inch",4.5,333,323.99,"Luggage","False",100
294829,"B0BNF5TRHY","Premium Rolling Garment Bag with Multiple Pockets, Black, 45-Inch",4.5,40,209.99,"Luggage","False",200
294830,"B081JDHNX1","Centric 2 Hardside Expandable Luggage with Spinners, True Navy, 3-Piece Set (20/24/28)",4.5,2820,399.92,"Luggage","False",100
294831,"B0C4KMQBWN","Luggage Carry On Luggage Underseat Luggage Suitcase Softside Wheeled Luggage Lightweight Rolling Travel Bag Underseater (Black, Carry-On 16-Inch)",4.4,124,79.99,"Luggage","False",700
294836,"B07XVZPTD8","Women's Mobile Solution Spinner Mobile Office ,Telescoping Handles, Black",4.5,390,139,"Luggage","False",200
294837,"B07PY38F5H","Garment Bags for Travel, Large Suit Travel Bag for Men Women with Shoulder Strap, Mancro Convertible Carry On Garment Bag Gift for Business Trip - 2 in 1 Hanging Suitcase Luggage Bag for Travel, Black",4.4,4723,39.99,"Luggage","False",1000
294838,"B07BKKMZWN","Maxlite 5 Softside Lightweight Underseat Carry-On Travel Tote, Overnight Weekender Bag, Men and Women, 18 inch",4.7,3941,84.99,"Luggage","False",400
294839,"B08KYG83TG","4010 Softside Luggage with Spinner Wheels, Black, Carry-On 18-Inch",4.5,709,105.46,"Luggage","False",500
294840,"B003VB9FCO","Rio Rugged Fabric Expandable Carry-on Luggage, Purple, 2 Wheel",4.3,26187,69.99,"Luggage","False",800
294841,"B09QCVWZGR","Limoomil Heavy Duty Waterproof Garment Bag for Travel, Tear Resistance Suit Bag for Men Travel for Suits, Tuxedos, Coats, Uniform. 42 inch, Darkgrey",4.5,723,23.99,"Luggage","False",1000
294842,"B09R2KB32B","Chatelet Hardside 2.0 Luggage with Spinner Wheels, Angora, Carry-on 21 Inch",4.5,437,254.83,"Luggage","False",100
294843,"B0BB6M3Z74","Expandable Foldable Luggage Bag Suitcase Collapsible Rolling Travel Luggage Bag Duffel Bag for Men Women Lightweight Suitcases",4.3,2360,79.99,"Luggage","False",400
294844,"B09R2NHZGJ","Helium DLX Carryon Garment Bag with Spinner Wheels, Black, Carry on 20 Inch",4.2,22,201,"Luggage","False",100
294845,"B07DMBG7CX","Xpedition 30 Inch Multi-Pocket Upright Rolling Duffel Bag",4.3,6046,42,"Luggage","False",300
294846,"B0BHCB2342","Underseat Carry On Luggage Suitcase Softside Lightweight Rolling Travel Bag Spinner Suitcase Compact Upright 4 Dual Wheel Bag",4.5,491,79.99,"Luggage","False",600
294847,"B09Q16LQDR","Carry On Luggage, Suitcase with Wheels & Front Opening, 20in Spinner Luggage Built in TSA Aluminum Frame PC Hardside Rolling Suitcases Travel Bag - Ivory white",4.3,492,175.99,"Luggage","False",200
294849,"B0BTNRBD37","Waxed Canvas Leather Suit Luggage Garment Bag with Shoulder Strap for Work and Business",4,1,84.99,"Luggage","False",0
294851,"B0B1NZM4ZS","2 in 1 Canvas Leather Suit Luggage Garment Bag with Shoulder Strap for Travel and Business Trips (Black)",4.1,18,109.99,"Luggage","False",0
294852,"B00GI3572E","Women's Spinner Mobile Office, Black, One Size",4.6,2042,164.99,"Luggage","False",200
294853,"B08WCGDRZD","Voyageur Leger International Carry-On - Luggage with Wheels - Suitcase for Women & Men - Black & Gold Hardware",4.5,17,695,"Luggage","False",50
294854,"B0B2X1BDFH","Stratum 2.0 Expandable Hardside Luggage with Spinner Wheels, 28"" SPINNER, Slate Blue",4.5,395,89.95,"Luggage","False",300
294855,"B07456MK3Y","Carry-On Softside 8-Wheeled Spinner Garment Bag Luggage, Black, 21-Inch",4.4,198,127.27,"Luggage","False",200
294856,"B081FT4C2H","Cosmo Hardside Spinner Luggage, Fern Green, Carry-On 20-Inch",4.4,1880,46.4,"Luggage","False",700
294857,"B084P184MG","Ascella X Softside Expandable Luggage with Spinners, Black, Checked-Large 29-Inch",4.5,1703,198.41,"Luggage","False",100
294858,"B0C6KN855L","Carry On Underseat 16-inch Multi-functional Underseater Lightweight Overnight Suitcase with Wheels Roller Case for Women Men Travel Business, Black",4.5,78,88.99,"Luggage","False",300
294859,"B0936RQ4BR","Luggage Sets 3 Piece Softside Expandable Lightweight Durable Suitcase Sets Double Spinner Wheels TSA Lock Black (20in/24in/28in)",4.5,2995,144.39,"Luggage","False",200
294860,"B008PSVUUI","Helium Aero Hardside Expandable Luggage with Spinner Wheels, Blue Cobalt, Carry-On 21 Inch",4.4,7594,114.08,"Luggage","False",200
294861,"B015DC21PG","Melrose Upright Wheeled Underseater Luggage, Red, Carry-On 15-Inch",4.3,2997,59.99,"Luggage","False",600
294862,"B0C1BV92WS","Venture Luggage and Travel, Laurel, 7-Piece Set",4.1,28,169.53,"Luggage","False",200
294863,"B07C2PXPM4","Luggage Expandable(only 28"") Suitcase 3 Piece Set with TSA Lock Spinner 20in24in28in (lake blue)",4.7,8016,179.99,"Luggage","False",200
294864,"B07SKCD6XR","Women's Alma Hardside Spinner Luggage, Expandable, Rose Gold, Carry-On 20-Inch",4.6,4285,63.96,"Luggage","False",500
294865,"B099XBTHPK","5 Piece Kids' Luggage Set, Cars",4.7,4209,55.2,"Luggage","False",500
294866,"B07MGHP7SM","Alpha 3 International Expandable 4-Wheeled Carry-On - Weekend and Internation Travel Luggage - Black",4.1,60,895,"Luggage","False",0
294867,"B07VMRKC5F","Convertible Travel Garment Bag,Carry on Garment Duffel Bag for Men Women - 2 in 1 Hanging Suitcase Suit Business Travel Bag",4.3,5201,45.99,"Luggage","False",700
294868,"B07HGGV482","Tourlite Softside Expandable Luggage with 4 Spinner Wheels, Lightweight Suitcase, Men and Women, Black, Carry-On 21-Inch",4.5,239,144.49,"Luggage","False",200
294869,"B08GD1WLS4","Sympatico Hardside Domestic Spinner Luggage, Matte Black, 22-Inch Carry-On",4.6,167,599,"Luggage","False",50
294870,"B094LVRCZD","Boren Polycarbonate Hardside Rugged Travel Suitcase Luggage with 8 Spinner Wheels, Aluminum Handle, Black, Checked-Large 30-Inch",3.9,3065,99.99,"Luggage","False",300
294871,"B07MX2GMZM","Unisex Alpha 3 Continental Expandable 4 Wheeled Carry-On",4.1,35,975,"Luggage","False",0
294872,"B074KV7M6N","Luggage 4 Piece Set Suitcase Expandable TSA lock spinner softshell",4.6,2846,189.99,"Luggage","False",200
294873,"B0C5R989W2","Carry On Luggage 20 Inch Expandable Suitcase with Spinner Wheel, 3 Piece Hard Shell Luggage Set with TSA Lock",4.5,264,89.97,"Luggage","False",300
294874,"B00TXPG8D6","Original X Large Waterproof Washable Tip Proof Durable Open Tote Bag for the Beach Boat Pool Sports 19x15x9.5",4.8,6190,96.24,"Luggage","False",300
294875,"B0873S4BV4","ZDX Luggage, Black, Carry-On 22 Inch",4.5,62,499,"Luggage","False",50
294880,"B004FCQAIU","Amsterdam Softside Expandable Rolling Luggage, TSA-Approved, Lightweight, Navy, Carry-on 21-Inch",4.2,19775,49.99,"Luggage","False",400
294881,"B00BTK1AKY","Melbourne Hardside Expandable Spinner Wheel Luggage, Blue, 3-Piece Set (20/24/28)",4.3,11225,137.3,"Luggage","False",200
294882,"B07P927Y9F","Luggage Suitcase Piece Set Carry On ABS+PC Spinner Trolley with pocket Compartmnet Weekend Bag(Night navy, 2-piece Set)",4.4,4351,179.99,"Luggage","False",100
294883,"B07BL4XRQ2","Maxlite 5 Softside Lightweight Rolling Underseat Tote Upright 2 Wheel Bag, Men and Women, Black, 16-Inch",4.6,823,124.4,"Luggage","False",200
294884,"B09VPDMFSY","Garment Duffle Bags for Travel, Bukere Convertible Carry on Garment Duffel Bag for Men Women, Shoe Compartment, 2 in 1 Hanging Dress Suitcase Suit Travel Bags, Midnight Grey",4.6,1808,49.99,"Luggage","False",600
294885,"B072Z7K96L","Clear PVC Suitcase Cover Protectors 28 Inch Luggage Cover for Wheeled Suitcase (28''(24.80''H x 19.90''L x 12.40''W))",4.2,4751,17.99,"Luggage","False",1000
294886,"B07MGHN9SW","Alpha Continental Dual Access 4-Wheeled Carry-On Luggage - Rolling Suitcase for Men and Women - Luggage Carry-On with 4 Spinner Wheels - Rolling Luggage with Security Zippers",4.3,47,1050,"Luggage","False",0
294887,"B0BZHP591K","Versatile Aluminum Frame Carry-On Luggage with USB Charging Port, Front Compartment, TSA Lock, Airline Approved Carry On Hardside Suitcase with Spinner Wheels(White, 20-lnch)",3.9,26,189.99,"Luggage","False",100
294888,"B0B12RPMXF","Platinum Elite Hardside Expandable Spinner Wheel Luggage TSA Lock Hard Shell Polycarbonate Suitcase, Dark Sky Blue, Carry on 21-Inch",4.4,745,314.49,"Luggage","False",50
294889,"B07PQNMT5K","Winfield 3 DLX Hardside Luggage with Spinners, 3-Piece Set (20/25/28), Graphite Grey",4.3,3376,431.17,"Luggage","False",50
294890,"B0C6GPCDRD","Garment Bag Travel Suit Bag for Men Large 40-Inch Carry on Garment Bag Up to 3 Suits for Business Trips,2 in 1 Hanging Suitcase Luggage Bags for Travel,Foldable Carry On Bag Fits 15.6Inch Laptop,Black",4.8,54,45.99,"Luggage","False",500
294891,"B0BLMT9CF1","Carry On Luggage 22x14x9 Airline Approved, 1OO% PC Lightweight Carry On Hardside Suitcase, 20 Inch Hard Shell Luggage with Spinner Wheels, Waterproof Rolling Suitcase for Men and Women, Black",4.3,102,84.79,"Luggage","False",200
294896,"B0B4NPQ1PH","3 Piece Luggage Sets,Suitcase with Spinner Wheels,Luggage Set Clearance for Women, Lightweight Rolling Hardside Travel Luggage with TSA Lock (Black, 5PCS)",4.4,1336,199.95,"Luggage","False",100
294897,"B002B4K5Z8","Duffel Bag",4.7,14145,19.99,"Luggage","False",1000
294898,"B07WY7BQ5K","Queensbury, Navy, 4 Piece",4.3,233,376.34,"Luggage","False",50
294899,"B07B6J1H24","Fieldbrook XLT Softside Upright Luggage, Black, 4-Piece Set (BB/WD/21/25 UP)",4.4,8568,80,"Luggage","False",300
294900,"B01DTGGYSI","Belle Voyage Softside Luggage with Spinner Wheels, Black, Carry-On 21-Inch",4.6,2456,78.9,"Luggage","False",300
294901,"B07FNSKMST","Oxford Expandable Spinner Luggage Suitcase with TSA Lock - 30.1 Inch, Black",4.5,2946,119.47,"Luggage","False",100
294902,"B085779HFG","Reaction Chelsea Luggage Chevron, Black, 4 Underseater",4.4,2382,139.99,"Luggage","False",100
294903,"B07XGHDK66","Pelican Air 1615 Travel Case - Suitcase Luggage (Blue)",4.7,386,509.95,"Luggage","False",0
294904,"B0C7J43WFH","18 Inch Personal Item Removable Wheels Suitcase 2.0 Converts From Hardshell Carry-On Into Under The Seat Luggage and Fits Into Airline Personal Item Sizer 18x14x8 Inch Requirements",4.4,319,119.99,"Luggage","False",50
294905,"B09WXLYG6C","Aspire DLX Softside Expandable Luggage with Spinner Wheels, Checked-Medium 25-Inch, Emerald",4.6,594,130.29,"Luggage","False",200
294906,"B06XKFY3FR","Tri-Fold Garment Bag",4.6,5142,36.68,"Luggage","False",600
294907,"B09JSFMSBP","Carry On Garment Bag, Large PU Leather Duffle Bag for Women, Waterproof Garment Bags for Travel with Shoe Pouch, 2 in 1 Hanging Suitcase Suit Travel Bags, Gifts for Women, Pink",4.3,3950,42.99,"Luggage","False",700
294910,"B0BLNMZKQN","Weekender Bags for Women,Carry on Bag,Overnight Bag with Trolley Sleeve,Sports Tote Gym Bag,Travel bag for Women, White",4.7,1218,26.99,"Luggage","False",0
294911,"B0C2KQM3PG","Travel suitcase set 3 piece 20/24/28 Lightweight Durable ABS Carry on Luggage with TSA Lock hard suitcases Wine Red Local Warehouse",5,4,120.85,"Luggage","False",0
294912,"B09RK5RNTD","MISSLO 65"" Long Garment Bags for Travel Dress Bags Wedding Dress Cover Waterproof Clothing Bags Storage Traveling Clothes Protector for Closet Wardrobe Bags 2 Packs for Gowns, Tuxedos, Coats, Black",4.4,1147,20.97,"Luggage","False",1000
294913,"B0BZVJKRGM","Luggage Sets, Suitcases with Wheels, 3 Piece Luggage Set, Suitcase Set with TSA Lock Spinner Wheels YKK Zippers, 20in 24in 28in (Dark Green)",4.7,165,169.99,"Luggage","False",100
294914,"B0BGP47CB6","Carry On Luggage 20 Inch,Softside Expandable Suitcase with Spinner Wheels, Travel Luggage Airline Approved Rolling Lightweight Suitcases with Front Pocket for Women Men (Black)",4.3,195,94.99,"Luggage","False",300
294915,"B0B69MZ75Q","20 Inch Carry On Luggage 22x14x9 Airline Approved, Carry On Suitcase with Wheels, Hard-shell Carry-on Luggage, Navy Small Suitcase, Hardside Luggage Carry On with Cosmetic Carry On Bag",4.1,432,98.64,"Luggage","False",200
294916,"B0C991K659","Carry on Luggage 22x14x9 Airline Approved, 20 Inch Hardshell Spinner Hardside Suitcase with Wheels, USB Port, TSA Lock for Travel Quick Getaway Business (Green)",4.8,103,139.99,"Luggage","False",100
294917,"B084LP1JLY","Anzio Softside Expandable Spinner Luggage, Teal, Checked-Large 30-Inch",4.1,1706,98.62,"Luggage","False",300
294918,"B09BBSBMJF","Quest Hardside Spinner Luggage, Grey/Orange, Carry-On 21-Inch",4.7,112,69.99,"Luggage","False",200
294919,"B074ZKXZ74","4 Kix Expandable Softside Luggage with Spinner Wheels, Black/Grey, Carry-On 21-Inch",4.6,2273,78.83,"Luggage","False",300
294920,"B08YYC49TY","Luggage Expandable Suitcase PC+ABS 3 Piece Set with TSA Lock Spinner Carry on 20in24in28in(Black, 3 piece set)",4.6,1351,169.99,"Luggage","False",100
294921,"B08HR767FC","66” Premium Tri-Fold Carry On Destination Wedding Dress Travel Garment Bag, Black, 66 Inch",4.7,117,169.99,"Luggage","False",100
294922,"B09Y28D7QT","Black, 22 Inch Garment Duffle Bag",4.3,20,369,"Luggage","False",50
294923,"B0C9ZHNNF6","Carry on Luggage with Front Compartment, Airline Approved, 22-Inch Suitcases with Wheels for Trips, Men, Women, 22 X 14 X 9 Inches (Plein Air Blue)",4.8,86,112.99,"Luggage","False",100
294924,"B0C6G2RWQ7","Aluminum Frame Carry On Luggage with Cup Holder and Usb Port, Front Compartment, TSA Lock, 22x14x9 Airline Approved Carry-On Hardside Suitcase with Spinner Wheels(White, 20-lnch)",3.9,17,179.99,"Luggage","False",100
294925,"B0BXVWJ644","Omni 2 Hardside Expandable Luggage with Spinner Wheels, ICY Lilac, 2-Piece Set (20/28)",4.4,234,190.48,"Luggage","False",50
294926,"B084YXHFCL","Road Runner Carry On Luggage, 20‘‘ Lightweight PC Hardside Luggage with Front Pocket, Rolling Suitcase with Spinner Wheels, Travel Suitcase for Women & Men, TSA Locks-Black",4.4,762,179.99,"Luggage","False",100
294927,"B0826L1NV2","Women's Hudson Softside 3-Piece Spinner Luggage Set, Black with Rose Gold, (16/20/28)",4.3,988,119.55,"Luggage","False",100
294928,"B09Y29HTQH","Baseline, Black, Carry-On Garment Spinner Bag",4.6,12,779,"Luggage","False",0
294929,"B07YGY827P","Pro Travel Softside Expandable Luggage with Spinner Wheels, Black, Carry-On 21-Inch",4.4,257,254.99,"Luggage","False",50
294930,"B07QYC2621","Crew Versapack Softside Expandable 8 Spinner Wheel Luggage, USB Port, Men and Women, Titanium Grey, Carry on 21-Inch",4.7,298,229.49,"Luggage","False",50
294931,"B0B6NCSD1F","Luggage Suitcase expandable (only 28”) ABS+PC Spinner suitcase with TSA Lock carry on 20 in 24in 28in",4.6,1289,89.99,"Luggage","False",200
294932,"B09Y2BNMTM","Uprights, Black, 21-inch Baseline Global Carry-On",4.6,46,659,"Luggage","False",0
294933,"B00BL9XDVC","Melbourne Hardside Expandable Spinner Wheel Luggage, Purple, Carry-On 20 inches",4.5,7891,67.34,"Luggage","False",300
294934,"B07QQNTNMD","SLEEPING LAMB 72'' Bridal Wedding Gown Dress Garment Bag 15'' Gusseted Garment Cover Shoe Pockets Travel Garment Storage Bag for Prom, Evening Gowns, Black",4.7,3577,17.99,"Luggage","False",1000
294935,"B07JLZPPQY","by Stokke BedBox, Pink Lemonade - Kid's Ride-On Suitcase & In-Flight Bed - Help Your Child Relax & Sleep on the Plane - Approved by Many Airlines - Best for Ages 3-7",4.3,346,229,"Luggage","False",50
