"uid","asin","title","stars","reviews","price","category","isBestSeller","boughtInLastMonth"
297210,"B09VYKZBJF","Lineal 28"" Hardside Checked 8 Wheel Expandable Spinner, Oyster Grey",2.7,2,127.5,"Luggage","False",0
297211,"B00BV5M8OY","28 Inch 8 Wheel Spinner, Olive Green, One Size",4.4,100,159.99,"Luggage","False",0
297212,"B0BB86RQ3L","Gannett 22"" Hardside Carry-On 8 Wheel Expandable Spinner Luggage, Rust",3.6,4,85.35,"Luggage","False",0
297213,"B09DFKB31T","Xstyle 2Pcs 360 Swivel Suitcase Caster Wheels with Screw Black Small Wear Resistant Wheel Outdoor Luggage Travel Suitcase Wheels Replacement for W041 Suitcase Repair 1.92x0.66x3.54inch",3.4,7,12.99,"Luggage","False",0
297214,"B09VYKRHT6","Lineal 21"" Hardside Carry-On 8 Wheel Expandable Spinner, Dark Grey",5,4,93.17,"Luggage","False",0
297215,"B07KYXBF4L","Designer Luggage Collection - Expandable 24 Inch Softside Bag - Durable Mid-sized Lightweight Checked Suitcase with 4-Rolling Spinner Wheels (Royal Blue)",3.9,15,139.99,"Luggage","False",0
297220,"B0CHF277Y5","Mom Charms for Bogg Bag,Bogg Bag Charms Mom Accessories,Decorative Charm for Beach Tote Bag Rubber Beach Bag",4.6,20,12.98,"Luggage","False",0
297221,"B07TK3KB4Y","45"" Luxury Fur Coat Cotton Blend Cloth Garment Bags for Travel & Hanging Clothes (Grey - Houndstooth Trim) - Suit Covers Garment Bag for Men & Women Dress Bag - Closet Storage Suit Bag, Coat Storage",4.5,10,38.99,"Luggage","False",0
297222,"B0C2CBRGXT","2 in 1 Canvas Leather Suit Luggage Garment Bag with Shoulder Strap for Travel and Business Trips (Black)",0,0,109.99,"Luggage","False",0
297223,"B099X8ZNHR","Premium Nylon Carry Bag (Orange)",4.8,35,0,"Luggage","False",200
297224,"B09VYM1135","Legion 28"" Hardside Checked 8 Wheel Expandable Spinner, Silver",3.3,3,105.88,"Luggage","False",0
297225,"B0BWR6VH6B","Clear PVC Suitcase Cover Protectors 20/24/26/28/30 Inch Suitcase Baggage Covers - Waterproof Dustproof and Anti-Scratch 20-30 Inch Luggage Cover (28inch)",3.4,14,15.99,"Luggage","False",0
297226,"B08G1SBRHK","Creative Brands Faithworks-Inspirational Large Canvas and Leather Tote, 20 x 11-Inch, God is Good",4.7,63,38.31,"Luggage","False",0
297227,"B0C4F8PFNQ","Carry-On Suitcase with Wheels - 21 inch Small Rolling Suitcase, Fully Collapsible Luggage, Hard Shell, Silent & Smooth Double Spinner, Red - Airline Approved for Travel Lovers",5,2,99.99,"Luggage","False",0
297228,"B07ZMDD2N5","Girls Tutu Bag for Ballet Costume Dance Garment Bag Breathable & Water Repellent 42 inches with 2 inch Gusset and Hanger Loops at both Ends of Bag BE UNIQUE UNICORN LOGO",4.7,7,24.5,"Luggage","False",0
297229,"B09NTNB34T","Seventeen",4.8,85,29.01,"Luggage","False",0
297230,"B0C2ZSDYFH","Luggage Covers For Suitcase Tsa Approved Luggage Cover PVC Clear Suitcase Covers for Luggage Waterproof Suitcase Cover Fits 28inch Travel Case",3.9,40,18.65,"Luggage","False",0
297231,"B08536FBKP","Men's Black Suit Garment Bag for Travel and Storage",4.5,115,9.9,"Luggage","False",0
297236,"B0C9C9KPFK","MOMLIFE Charm for Bogg Bags | Simply Southern Bogg Bag Charms | Easy to Install & Waterproof | Beach Charm Accessories, Rubber Beach Totes Charms | Bogg Bag Accessories Charms | Women’s Accessories",4.7,9,12.95,"Luggage","False",0
297237,"B00AO6I0MU","17"" Carry-On - Small (Fits Jem, etc.) (Black)",4.5,43,160.86,"Luggage","False",0
297238,"B00J5FB4QA","Extra Large Zip-Pocket Duffel, Black, One Size",4.6,5,167.71,"Luggage","False",0
297239,"B0C8NQ7P4N","Initial Canvas Tote Bag with Makeup Bag with Zipper, Halloween Bats Beach Bag for Women",0,0,19.99,"Luggage","False",0
297240,"B0BB6BRYBK","Sequins 21"" Upright Luggage, Black",5,5,91.03,"Luggage","False",0
297241,"B0C1WVTQ5L","Carry On Garment Duffel Bag for Travel, Convertible Hanging Suit Bag Duffel Bag with Shoe Compartment, Weekender Gym Bag with Detachable Shoulder Strap",4.2,11,29.99,"Luggage","False",0
297242,"B0BCL8ML2Y","2 Pcs - CVS Receipt Scarf and CVS Receipt Tote Bag",5,5,39.95,"Luggage","False",0
297243,"B0CCL9YNY9","Luggage Wheel Covers 8Pack Carry on Luggage Wheel Protective Covers for Most 8-Spinner Wheels Travel Luggage Cover (Black)",0,0,13.99,"Luggage","False",0
297244,"B0BB62281Z","Peeking Karl Upright Luggage with 8 Spinner Wheels, ABS+PC Case, Weekend Bag, Black",5,3,126.32,"Luggage","False",0
297245,"B08412G5YB","Harbor Spinner Suitcase, Navy, Carry-On",3.8,4,89.98,"Luggage","False",0
297246,"B00E8HUQMI","FLW-Kabana Men's Tri fold, Black, One Size",4.3,580,29.9,"Luggage","False",0
297247,"B0C6YDTNB3","Travel Suitcase Wheels Luggage Swivel Wheels, 4PCS Swivel Wheel Replacement Luggage Bearings Repair Set for Luggage Kits Suitcase Replacement Wheels",5,1,17.99,"Luggage","False",0
297252,"B09M97FL1G","Deluxe Travel Garment Bag with Two Pockets, Navy, 40-Inch",4.6,14,59.99,"Luggage","False",0
297253,"B0BKYVM3YK","Girls Tutu Garment Bag - 30 In. Pancake Dance Bag with 3 In. Gusset for Kids Tutu Skirts with Inner Strap & Hanger Loop to Hold Shape of Tutus for Girls. Best for Younger Kids with Smaller Tutus.",5,2,30,"Luggage","False",0
297254,"B09ZKPBG2V","Camp 4 Duffel 65, Light Army Camo Print, Medium",0,0,150,"Luggage","False",0
297255,"B0CDM624J9","Durable 30 Inch Rolling Trolley Travel Bag | Water-Resistant Carry On Luggage Bag for Men & Women | Ideal Rolling Duffle Bag for Long & Short Trips | 3 Zipper Compartments Travel Suitcase",0,0,39.99,"Luggage","False",0
297256,"B09VSGPYWB","Accuracy 32"" Softside Checked 8 Wheel Spinner, Grey Skin",4,5,139.99,"Luggage","False",0
297257,"B0BRSYBP15","Clavel Hardside Expandable Luggage with Spinner Wheels, Black, 2-Piece Set 19/30",2,2,351.34,"Luggage","False",0
297258,"B0BN6TSQFG","Census 3 Piece Softside 8 Wheel Spinner, Grey Skin, 3 Pc Set",0,0,314.99,"Luggage","False",0
297259,"B09KR6FPY4","Mesh Tote Bag, Extra Large Beach Bag with Zippers Multiple Pockets, Lightweight Fordable Unisex for Gym Travel Picnic Groceries",4.4,90,22.99,"Luggage","False",0
297260,"B0C6R84MG1","Traveller Large Tote with Adjustable Webbing Strap",0,0,64.95,"Luggage","False",0
297261,"B0B1NVD7DD","Waxed Canvas Leather Suit Luggage Garment Bag with Shoulder Strap for Work and Business (Grey)",3.8,10,99.99,"Luggage","False",0
297262,"B07FY3XWV8","Betsey Johnson Designer Carry On Luggage Collection - Lightweight Pattern 22 Inch Duffel Bag- Weekender Overnight Business Travel Suitcase with 2- Rolling Spinner Wheels (Paris Love)",4.3,78,65.99,"Luggage","False",0
297263,"B0C9LVDJY2","Renegade_Collection, Seafoam, 28-Inch Checked",0,0,149.99,"Luggage","False",0
297264,"B09FSZDFDJ","Large Capacity Folding Travel Bag, Dry Wet Separated Gym Bag for man and women, For Gyms and Weekend Getaway Portable Travel Lightweight Waterproof Bag",4.4,416,15.99,"Luggage","False",0
297265,"B0B3WSFBY5","Ginza Travel New Classic Aluminum Frame Fashion Bright Color Suitcase TSA Combination Lock Universal Wheel （Colorful Series） (Sky Blue, Carry-On 20"")",5,3,89.97,"Luggage","False",0
297266,"B09MDMC14X","Men's Canvas Garment Dye Short",0,0,177.48,"Luggage","False",0
297267,"B07GT3W9CM","Women's Denim Garment Bag",5,4,94.11,"Luggage","False",0
297268,"B0BY5VM54H","Luggage Cover Washable Suitcase Cover Suitcase Protector Anti-scratch Suitcase cover Fits 18-32 Inch Luggage (Venice-12,S fit 18-21inch)",4.4,38,12.88,"Luggage","False",0
297269,"B07B4KXDKG","Medium Traveler Bag, Carbon Gray",0,0,87.91,"Luggage","False",0
297270,"B0B9FB1Y4Z","Eluder 28"" Softside Checked 8 Wheel Expandable Spinner Set, Orange Camo",0,0,134.5,"Luggage","False",0
297271,"B0BFK72W1W","Elevate 28"" Hardside Checked 8 Wheel Expandable Spinner, Ice Blue",4,3,106.29,"Luggage","False",0
297272,"B09BVPL6GR","Clear PVC Suitcase Cover Protectors 20 22 24 28 Inch Luggage Cover for Wheeled Suitcase (28Inch)",4.2,18,16.99,"Luggage","False",0
297273,"B0BZ8L4K87","Travel Luggage Cover I TSA approved Suitcase Protector I Luggage Covers for Suitcase I Suitcase cover Bag I Luggage protector I Durable & Washable I carry on luggage cover protector",4,57,14.98,"Luggage","False",0
297274,"B0C2HSYP9Y","3 Pcs PVC Luggage Cover Waterproof Transparent Suitcase Cover Thicken Luggage Protector for Travel, Fits 20"" 24'' 28"" Luggage (Navy Blue)",3.4,7,18.98,"Luggage","False",0
297275,"B09FTF1GD7","Luggage Sets,PC+ABS Hardshell Lightweight Durable Spinner Wheels Suitcase, Blue, 3-Piece (20""/24""/28"")",3.4,266,139.93,"Luggage","False",0
297280,"B0C3C7CBCC","Luggage Sets 3 Piece, All Expandable Suitcase Set, PC Hard Case Luggage with TSA Lock Spinner Wheels YKK Zippers, 20in 24in 28in (Green)",3.2,4,179.99,"Luggage","False",0
297281,"B0849KVBQG","Weekender - Smell Proof Bag w/ Combiation Lock (Black)",4.5,25,119,"Luggage","False",0
297282,"B0CD3K966Q","Zoofen Luggage Wheels Replacement Black Suitcase Wheels Replacement Suitcase Caster Wheels with 2 Screw Holes(Z-237)",0,0,19.99,"Luggage","False",0
297283,"B0B4V511CW","Paris Hardside Luggage with Spinner Wheels, Black, 3-Piece Set (20/24/28)",3.6,53,300,"Luggage","False",0
297284,"B0C7P3YPSP","Replacement Luggage Wheels for Suitcases, Set of 2, TarppedRock Travel Suitcase Spinner Wheel Repair Kit for Customs Trolley Case (TR47R-2 Pcs)",0,0,16.99,"Luggage","False",0
297285,"B0BQYLSYPK","Seinfeld Tv Show Gift Seinfeld Tote Bag Seinfeld Fan Gift Classic American Sitcom Merchandise",4.6,30,16.89,"Luggage","False",0
297286,"B0C5WG5MS5","Stowaway Packable 25l Cinch Tote with Adjustable Cord-Lock Closure and Exterior Slip Pocket",0,0,40,"Luggage","False",0
297287,"B0861Z6MLL","Airox Hardside Carry-On (Orange, Frequent Flyer)",4.6,42,0,"Luggage","False",0
297288,"B0CDPR8FJX","10 Pack Luggage Wheel Covers, Silicone Silent Protection Cover for Carry-on Luggage with Spinner Wheels Luggage Sets (Orange)",0,0,12.99,"Luggage","False",0
297289,"B0C1THVG8L","Kids Travel Suitcase Box Toy Car (Blue 2)",4.5,11,79.95,"Luggage","False",0
297290,"B0B4VB5YKB","Paris Hardside Luggage with Spinner Wheels, Charcoal, 3-Piece Set (20/24/28)",4.2,47,300,"Luggage","False",0
297291,"B0B6BVT2RW","Garment Bags for Dance Costumes, 40 inch Waterproof Hanging Clear Garment Bag with Gusset for Dress, 4 Pockets, Handles, Name Tag for Kids, Teens, and Adults(Purple, 1 Pk)",4.8,21,19.99,"Luggage","False",0
297296,"B09SNFCR4X","Utility Tote Bag",4.6,207,74.53,"Luggage","False",0
297297,"B0CBPHQQLX","Crochet Tote Bag For Women, Crochet Mesh Beach Tote Bag Summer Vacation Aesthetic Boho Knit Bag for Women",5,1,11.99,"Luggage","False",0
297298,"B0BRB1MT9G","Zak Bagans Gift We Will Never Fully Understand Reusable Canvas Tote Bag Ghost Adventures Show Handbag",0,0,15.89,"Luggage","False",0
297299,"B07S9D74K4","Suitcase, Multicolour, 55cm",4.3,37,140.17,"Luggage","False",0
297300,"B0CBK1K77Z","ANBOO 50-inch-long Garment Bags for Travel, Large Carry 0n garment Bags for Men Women Travel with Shoulder Strap Foldable Hanging Suit Bag for Business Trip, 2 in 1 Mens Suit Cover Bag Gift for Travel",5,6,34.99,"Luggage","False",0
297301,"B0C48W5JR4","28 Inch Luggage with Spinner Wheels Softside Expandable Large Suitcase",0,0,149.99,"Luggage","False",0
297302,"B09C4FB4VB","Luggage Cover 20 22 24 28 Inch Suitcase Cover Rolling Luggage Cover Protector Clear EVA Suitcase Cover for Carry on Luggage(22Inch)",4.1,32,13.99,"Luggage","False",0
297303,"B0C1JLP8J5","Assembly Two Toned Hard-Sided Polycarbonate Luggage Trolley Bag, White Blue, Cabin 20 Inches, Luggage",4.5,26,69,"Luggage","False",0
297304,"B09R2N8C57","Maubert 2.0 Carry on Duffle Bag",5,1,62.18,"Luggage","False",0
297305,"B0BX98CQM4","4 Pcs Jelly Bags Jelly Purse Jelly Tote Jelly Basket Kids Pink Purse Reusable Jelly Basket Girls Beach Bag Toddler Halloween Bridal Easter Basket Round",4.6,3,14.99,"Luggage","False",0
297306,"B0BBBHH8YH","52” Deluxe Travel Garment Bag",4.5,31,49.99,"Luggage","False",0
297307,"B07DM2ZKDQ","S'Cure DLX Spinner 55, 2.9 KG Hand Luggage, 55 cm, 34 liters, Black (Black/Gold Deluscious)",4.6,49,274.91,"Luggage","False",0
297312,"B07BXHRWTG","Spandex Travel Luggage Protector Suitcase Cover Fit 23-32 Inch Luggage (sloth, L)",4.3,297,18.99,"Luggage","False",0
297313,"B0BXL6VBFZ","20” Wide Handle Carry On Luggage, Hard Shell Trolley Suitcase with 8 Spinner Wheels for Easily Boarding, PC+ABS Quick Open Rolling Travel Case with TSA Lock for School & Holiday",4.3,5,128,"Luggage","False",0
297314,"B0C22S7792","Women Tote Bag Large Neoprene Tote Bag Fashion Woven Bag Neoprene Tote Handbag Roomy Shoulder Bags for Beach, Gym, Travelling",4,20,59.99,"Luggage","False",0
297315,"B07FDN7C7N","Original 3pc Expandable Suitcase Set with Spinner Wheels, Navy Plaid, One Size",5,6,207.17,"Luggage","False",0
297316,"B095KBQV2H","Terminal Bag 40L + 20L, 2-in-1 Luggage - 22 Inch Convertible Travel Bag Carry-On Backpack with Wheels and Detachable Backpack Set - Rolling Backpack Luggage - Steel",0,0,300,"Luggage","False",0
297317,"B07HDF9C39","Nema Expandable Hardside Spinner Luggage w/TSA Lock, Available in 3-Piece Set/22-inch/25-inch/29-inch, Black",4.1,71,99.97,"Luggage","False",0
297318,"B09QBY43P6","Skyway Epic 2.0 Hardside 4 Wheel Spinner, Lightweight Suitcase, Unisex, Stylish, Silver Lilac, Carry-On 20-Inch",4,9,79.99,"Luggage","False",0
297319,"B0CGRXBZ1V","Suitcase Hardside 20 inch Carry On Spinner Luggage with TSA Lock (Rose Gold)",4.6,3,69.99,"Luggage","False",0
297320,"B0BR5DBLVM","Mini AK Turn Lock Tote, Stone with Stone Grey Multi Plaid",0,0,55.19,"Luggage","False",0
297321,"B0C8CRGJ66","GinzaTravel Trunk Luggage 26 Inch suitcase with Spinner Wheels Scratch resistant texture Lightweight PC material with TSA Lock (Black, 26 inch)",4.7,8,119.97,"Luggage","False",0
297322,"B09XJKC1HH","Momentous 25"" Hardside Checked 8 Wheel Expandable Spinner, Tibet Lan",4.3,3,99.77,"Luggage","False",0
297323,"B0BN6R41M9","Census 28"" Softside Checked 8 Wheel Spinner, Grey Skin",5,1,119.99,"Luggage","False",0
297324,"B0C7C8TMLN","Fall Canvas Tote Bag with Zipper Pocket Personalized Gift for Women, Pumpkins Leaves Beach Bag CT53",0,0,13.99,"Luggage","False",0
297325,"B0B1QHFPGY","Lamyba Grandmother of the Groom Tote Bag, Grandmother of the Groom Gifts From the Bride, Black and White",4.8,523,21.99,"Luggage","False",0
297326,"B0C82PLGFW","Printed Luggage Cover, Blue/Orange Ombre, Medium",0,0,22.49,"Luggage","False",0
297327,"B0CBCPBY1K","Garment Duffle Bag，Convertible Duffle Garment Bag With Separate Shoe Compartment Suit Travel Bags for Men Travel Garment Bag Carry On Garment Bags for Travel",5,1,47.89,"Luggage","False",0
297328,"B09QFYD8V4","Lamyba Beach Bag, Canvas Beach Tote Bags for Women, Black and White",4.6,182,22.99,"Luggage","False",0
297329,"B07JZFMNSL","Soho 24"" 8-Wheel Spinner Luggage, Navy Red",5,1,130,"Luggage","False",0
297330,"B01LVUYT44","Vision Hardside Spinner Wheel Luggage, Assorted/Multicolor, Carry-On 20-Inch",4.6,71,64.99,"Luggage","False",0
297331,"B09XR5LYM3","PC+ABS Durable Japanese Luggage, Expandable with double-wheeled spinner, checked-large suitcase, 30 inch, Black, 5109-69-BK",3.3,4,259,"Luggage","False",0
297332,"B0B4TZMZ4L","Paris Hardside Luggage with Spinner Wheels, Silver, 3-Piece Set (20/24/28)",3.3,30,300,"Luggage","False",0
297333,"B0C38PY2BF","20 inch Carry On Luggage Airline Approved Large Suitcase with Spinner Wheels PC Hardshell TSA Lock",4.6,5,119.99,"Luggage","False",0
297334,"B09657W3JN","PORSCHE DESIGN Weekender - Roadster Leather",0,0,765,"Luggage","False",0
297335,"B09V1SRBZQ","Girls' Weekender Travel Tote Bag with Adjustable Strap and Interior Zipper Pocket - Pop Prints Collection",5,2,35.75,"Luggage","False",0
297340,"B07DNJNCDK","Black Suit Garment Travel Bags 3 Pack - 40"" X 24"" - By Your Bags",4.4,205,17.99,"Luggage","False",0
297341,"B0BF9MLJYG","Work Tote Bag for Women with USB Charging Port - 17.3"" Laptop Tote Bag - Large Work Bag with Yoga Mat Buckle",4.3,121,29.99,"Luggage","False",0
297342,"B07937F7F9","Ziplite 3.0, 20"" Carry-on, Hardside Spinner Luggage (Caribbean Blue)",5,2,229.99,"Luggage","False",0
297343,"B0C4R7M3FT","Classic 33 Liter Tote for Beach or Travel",4.8,7,62,"Luggage","False",0
297344,"B0BC3PLX2R","Large Tote Handbag Business Handbag Boutique Tote Bag Women Nylon",4.3,13,40.99,"Luggage","False",0
297345,"B0BHJK951Y","Neoprene Medium Crossbody Casual Lightweight Everyday Hand Bag for Women with Makeup Pouch, Neoprene Tote",4.2,166,33,"Luggage","False",0
297346,"B0C7FG24VH","Expandable ABS Hardshell Luggage Suitcase with Spinner Wheels Suit Case Lightweight, Blue/Brown, 3-Piece Set (20/24/28)",5,1,134.99,"Luggage","False",0
297347,"B0BYYXTB21","Rolling suitcase, Carry-On Luggage Hardside Expandable Luggage with Spinner Wheels Checked-Medium 24 Inch Red",3.9,11,60.99,"Luggage","False",0
297348,"B0BQ4LHPVS","Women's Alisa Spinner Suitcase, Purple Floral, 3pc Set",0,0,223.07,"Luggage","False",0
297349,"B0BBCGJWRS","Chapter Travel Kit",5,5,38,"Luggage","False",0
297350,"B09KRNX2QW","3 Piece Luggage Set Hardside With Spinner Wheels Clearance，20 24 28 Inch Suitcase With TSA Lock For Women Travel (red)",4.3,45,169.99,"Luggage","False",0
297351,"B06XFMYKF7","Travel Weekender Overnight Carry-on Shoulder Duffel Tote Bag (8"" x 12"" x 16 (Large), Black & White Polka Dots)",4.6,793,44.99,"Luggage","False",0
297356,"B0CDLJRMWM","7 PCS Rubber Beach Charms for Bogg Bags Inserts Charms Accessories for Bogg Bag Cute Beach Totes Bag Decoration Accessories for Women",5,1,12.99,"Luggage","False",0
297357,"B0C77WR5YN","Designer Luggage Collection - Lightweight 24 Inch Expandable Softside Suitcase - Mid-size Rolling 4-Spinner Wheels Checked Bag (Black, 24in)",1,1,159.99,"Luggage","False",0
297358,"B0BRXSXS85","TIME CAPSULE Carry On Luggage with Double Spinner Wheels, Hardside, 20 Inch, Quiet, TSA Lock Suitcase, Black",4.3,9,249.99,"Luggage","False",0
297359,"B08DCGZB8Y","Travel Beach Bag, Women Large Shoulder Handbags, Cotton Rope Handles Travel Tote Bag for Women",4.9,64,34.99,"Luggage","False",0
297360,"B0C7LVV8VX","3 Girls Bag - Extra Large Utility Tote Bags For Women With Zipper - Sandproof Beach Tote Bag, Pool Bag, Travel Bag",4.7,779,60,"Luggage","False",0
297361,"B00380TQJK","Mud Pie Classic Black and White Initial Canvas Tote Bags (H), 100% Cotton, 17"" x 19"" x 2""",4.8,9258,18.95,"Luggage","False",0
297362,"B0C8SNLX6X","BAUSTIN Overnighter Bag (MUSHROOM)",0,0,103.68,"Luggage","False",0
297363,"B094DM1BH3","“He restores my soul. Psalm 23:3” - great church work diaper bag for her mom wife gift",4.6,24,37.99,"Luggage","False",0
297364,"B0BW11PLC9","Sportina X-Bag - Large Tote Bag - 3-Way Shopper Shoulder Bag - Designer Handbag for Travel and Work (CAMOUFLAGE)",0,0,112.5,"Luggage","False",0
297365,"B0BZC7Y6FB","Luggage Suitcase with Spinner Wheels, Hardside Checked Luggage with TSA Lock, 24 Inch Medium Travel Suitcase (WIHITE,4PCS)",5,1,79,"Luggage","False",0
297366,"B0C6FV6RHV","Mermaid Canvas Tote Siren's song",0,0,39.99,"Luggage","False",0
297367,"B07N2QVSHC","Large Beach Bag For Women, Waterproof Sandproof Tote with Pocket Zipper Travel Utility Swim Pool Bag Tote",4.4,2351,18.99,"Luggage","False",0
297372,"B0C9LV2DL8","Renegade_Collection, Seafoam, 24-Inch Checked",0,0,129.99,"Luggage","False",0
297373,"B0C9D3DPGR","4 Pcs Book Lover Gifts Book Tote Bag Travel Cosmetic Bag Bookworm Keychain Bracelet with Card Reusable Washable Canvas Bag Bookish Key Chain Jewelry for Literary Reader Librarian Bibliophile",0,0,16.99,"Luggage","False",0
297374,"B0B693RRSS","Bling Butterfly Luggage Cover Suitcase Protector Fits 18-32 Inch Travel Suitcase Cover Washable Dustproof Anti-Scratch",4,25,19.99,"Luggage","False",0
297375,"B09DBGX6R3","Men's Short Haul Wheeled Bag",5,7,166.94,"Luggage","False",0
297376,"B09KMMDP78","Tote Bag for Women - Large Tote Handbag Purse - Stylish Black Neoprene Tote Bag with Shoulder Straps",4.3,103,40.95,"Luggage","False",0
297377,"B09VDBB2BR","Quaint 21"" Hardside Carry-On 8 Wheel Expandable Spinner, Cobblestone with Mulch Trim",4,10,94.17,"Luggage","False",0
297378,"B0BHQV6B6F","1 Pair Luggage Suitcase Wheel, A08 Trunk Luggage Wheel Spare Part (W041-2 Small) Plastic 360 Swivel Universal Wheel Replacement Luggage Wheel for suitcases/Draw Bar Box",4.1,6,11.99,"Luggage","False",0
297379,"B09HZXLN8S","BeeGreen Initial Canvas Tote Bag w Inner & External Pocket X-Large Cute Tote Bag w Zipper Closure Embroidery Monogram Personalized Beach Tote Bag Christmas Gifts for Women Teacher Friends Bride J",4.6,1324,16.99,"Luggage","False",0
297380,"B0BLFTFVLQ","Grove 3 Piece Set Rolling Luggage, Hardshell Suitcase with Spinner Wheels, 22, 27, and 31 Inch, Black",0,0,449.99,"Luggage","False",0
297381,"B0C3QGPRJ5","Breast Cancer Large Tote Bag Pink Ribbon Awareness Bag Breast Cancer Survivor Gifts We don't Know how Strong We are",5,1,19.99,"Luggage","False",0
297382,"B084V45NNX","Big, Light Blue, 56x80x29 Centimeterss",4.6,34,109.03,"Luggage","False",0
297383,"B0CCXSFBLD","Charms for Bogg Bag Cute Charms Accessories, Women Large Small Rubber Simply Southern Beach Totes Decor for Baby Bogg Bag",1,1,7.19,"Luggage","False",0
297384,"B076DRVF5Q","Main Handle J-Hook",4.8,55,14.49,"Luggage","False",0
297385,"B09DFPT58F","2Pcs 360 Swivel Suitcase Caster Wheels with Screw 2 inch Black Large Wear Resistant Wheel Outdoor Luggage Travel Suitcase Wheels Replacement for W041-2 Suitcase Repair",3.4,7,13.99,"Luggage","False",0
297386,"B0BS77CM6P","Suit Carrier Handmade from Full Grain Leather - Bourbon Brown",0,0,301.99,"Luggage","False",0
297387,"B0BWNC2DS7","Women Large Puffer Tote Bag Quilted Top-Handle Shoulder Bag Soft Down Cotton Padded Tote Handbag with Zippers",4.5,10,39.99,"Luggage","False",0
297388,"B0C1RGK1BP","Rubber Duck Elastic Travel Luggage Cover Travel Suitcase Protective Cover For Trunk Case Apply To 19''-32'' Suitcase Covermedium",5,2,9.99,"Luggage","False",0
297389,"B09Z7JXD5Q","Attuned 21"" Hardside Carry-On 8 Wheel Expandable Spinner, Charcoal",4.5,2,92.15,"Luggage","False",0
297390,"B091CZC28Z","Alomejor 2pz Suitcase Wheel Luggage Wheel Replacement Per Valigia Trolley Right and Left",3.6,18,18.75,"Luggage","False",0
297391,"B0BRL81FZ3","19 Pockets Large Utility Tote Bag Teacher Tote Bag for Women",3.9,52,25.99,"Luggage","False",0
297392,"B0B58R926C","Bibliophile Tote Bag S-4364",1,1,72.04,"Luggage","False",0
297393,"B0B14FMMHD","Helixian 21"" Hardside Carry-On 8 Wheel Expandable Spinner, Wine Red",3,1,103.19,"Luggage","False",0
297394,"B083HQYJLT","SHOWKOO Luggage Suitcase Replacement Wheels Rubber Swivel Caster Wheels Bearings Repair Accessories (007)",2.9,6,21.99,"Luggage","False",0
297395,"B09RLGPYT9","SierraComfort SC-CB1004 Carry Bag, Black",0,0,47,"Luggage","False",0
297400,"B0B6R1YX9Z","Travel Weekender Bag Geometric Luminous Overnight Duffle Carry On Tote for Women Ladies",4.7,805,37.99,"Luggage","False",0
297401,"B0BYCFWWC3","Zoofen Luggage Wheels Replacement Black Suitcase Wheels Replacement Suitcase Caster Wheels with 5 Screw Holes(Z-366)",0,0,19.99,"Luggage","False",0
297402,"B0785PNLVH","Bag",4.7,5886,193,"Luggage","False",0
297403,"B0C8ZFMXGG","Zippered woven large beach bag - Zippered, Waterproof -Boho Summer Bag- Jute Canvas Beach Tote | With Matching large pouch",0,0,29.99,"Luggage","False",0
297404,"B09CDQS979","Tote Bag Harry Potter Hogwarts - Cotton Reusable Travel Tote - Halloween Trick-or-Treat Bag - Let The Magic Begin",4.4,42,19.99,"Luggage","False",0
297405,"B0C139VTZN","Board Certified Behavior Analyst Tote Bag Behavior Analyst Tote Bag BCBA Therapist Gift",0,0,15.89,"Luggage","False",0
297406,"B07V2JWQ89","Freud-Diablo 3/8 X 12 SNAP Lock, Multicolor, DHS375XT12",4.7,105,18.49,"Luggage","False",0
297407,"B07DD3RZDN","New Premium Carry On Luggage Spinner - Super Light Weight, Maximum Capacity - The Carry On, Re-Imagined (Carry On, Navy)",3.8,119,139,"Luggage","False",0
297408,"B07MNKNPMZ","Furbo Smart Italy Hardside Spinner Luggage Carry-on, Silver, One Size",0,0,145.74,"Luggage","False",0
297409,"B00RXW8CVC","Kids Ride-On Suitcase & Toddler Carry-On Airplane Luggage: Bernard Bee Yellow",4.5,158,74.99,"Luggage","False",0
297410,"B0BZC4X1WB","Luggage Suitcase with Spinner Wheels, Hardside Checked Luggage with TSA Lock, 24 Inch Medium Travel Suitcase (BLACK,4PCS)",4,1,79,"Luggage","False",0
297411,"B0BF9TG7CT","Suitcase Wheels Replacement 360 Spinner Luggage Travel Wheel Kits Double Accessories Universal Rubber Swivel Trolley Casters Bearings Repair Tools Set Rotating Flexible Quietness (2pcs (55x15mm))",4.1,17,17.39,"Luggage","False",0
297416,"B0C7ZT9W1P","Bride Bag - Bride to Be Gifts for Bridal Shower, Neon Holographic Bride Beach Bag, Personalized for Engagement Honeymoon, Bachelorette Party Gift Bag",5,1,13.99,"Luggage","False",0
297417,"B0BQ3LZTQB","Baby Suitcase Play Toy, Cute Mini Travel Suitcase Box Plastic Rolling Suitcase Mini Luggage Box Play Accessoriespiece 15.5 x 10.5 x 7cm (Pink)",1,2,13.68,"Luggage","False",0
297418,"B0B8YHCK2B","BABY BOGG BAG Small Waterproof Washable Tote for Beach Boat 15x13x5.25 ( Green Apple)",5,22,113.8,"Luggage","False",0
297419,"B0B2ZP4WS8","St Tropez Trois 30"" Hardside Checked 8 Wheel Expandable Spinner, Black",2.8,4,147.19,"Luggage","False",0
297420,"B0C24LDPVG","Northbridge Expandable Hardside Spinner Bronze, Carry-On 20-Inch",0,0,155.99,"Luggage","False",0
297421,"B089T7VY7N","Capri 2.0 27""-Inch Spinner - Expandable Luxury Carry On Luggage With Spinner Wheels - Lightweight Carry On Suitcases with Wheels Made From Durable Polycarbonate - Bordeaux",5,2,0,"Luggage","False",0
297422,"B0CGWHHC51","Carry On Garment Bags for Travel,Suit Bag with Adjustable Shoulder Strap,Waterproof Foldable Luggage Bag for Men Women，2 in 1 Hanging Suitcase for Travel,Navy",0,0,36.99,"Luggage","False",0
297423,"B01NAYR7EA","ARIAT Unisex Team Garment Bag Blue Size One Size",4.7,6,119.95,"Luggage","False",0
297424,"B0C1GNKVH5","Canvas Tote Bag Women Satchel Bag with Zipper Tote Handbag Women Crossbody Bag Hobo Bag Daily Working Handbag",4.6,44,23.99,"Luggage","False",0
297425,"B0B52H262K","Disney Mickey Mouse 21 Inch Rolling Luggage, Hardshell Carry On Suitcase with Wheels, Charcoal",3.2,2,99.99,"Luggage","False",0
