"uid","asin","title","stars","reviews","price","category","isBestSeller","boughtInLastMonth"
295937,"B073WJ4GFW","Designer Luggage Collection - Large 28 Inch Expandable Softside Suitcase - Lightweight Checked Bag With 4-Rolling Spinner Wheels (Paige Silver)",4.3,39,129.99,"Luggage","False",0
295938,"B0BN4C574B","Cascade Softside Expandable Luggage Wheels, Jet Black, 24-Inch Spinner",4.1,18,138.99,"Luggage","False",0
295939,"B09Q75LNZM","7782 Hardside Expandable Luggage with Spinner Wheels, Silver, Carry-On 20-Inch",4.2,52,159.99,"Luggage","False",0
295940,"B0B2CNLL33","Disney Princess Girl Power 21 Inch Kids Rolling Luggage, Hardshell Carry On Suitcase with Wheels, Multi, Blue (FCGL0028SAMEC-410)",4.2,48,61.99,"Luggage","False",0
295941,"B09HV2VTWM","Luggage Suitcase with Spinner Wheels, 24'' Checked Travel Luggage Aluminum Frame PC Hardside with TSA Lock & Cover",4.4,474,199.99,"Luggage","False",0
295942,"B07ZQN59F4","Carry On Roller 42L - Black, One Size",4.4,17,170,"Luggage","False",0
295943,"B07896KSM7","Women's Luggage Adriana 29"" Hardside Check in Spinner, Leopard, One Size",4.1,162,158.63,"Luggage","False",0
295944,"B01BVERAE2","Classic Rolling Luggage",4.7,5191,60,"Luggage","False",0
295945,"B0C9MLJXKW","29 Inch Luggage with Expansion & Side Opening Design, 50 * 31(35)*76cm, 117L~133L Ligthweight ABS+PC Hardshell Checked Suitcase, TSA Lock & YKK Zipper with HINOMOTO 360° Wheels, Yellow",5,2,149.99,"Luggage","False",0
295946,"B07DM4TRRF","S'Cure DLX Spinner 75, 4.5 KG Hand Luggage, 75 cm, 102 liters, Black (Black/Gold Deluscious)",4.6,102,372.35,"Luggage","False",0
295947,"B073V9GML9","Jr. Kids' My First Hardside Spinner Luggage, Telescoping Handles, Ladybug, Carry-On 19-Inch",4.7,264,37.49,"Luggage","False",0
295948,"B015DC1ZGC","Speciale Hardside 2-Piece Expandable Spinner Luggage Set, Black, (20/28)",4.3,77,116.32,"Luggage","False",0
295949,"B07MQSHHRJ","Garment Bag for Wedding Dress-Bridal Cover for Your Long Evening Gown Perfect for Storage & Travel Easy Access Zipper & Gusset 3 Pockets for Accessories including Shoe Bag – 69X28 Inches",4.7,300,29.5,"Luggage","False",50
295950,"B0BHZRZYK2","Airox Large Hardside Case - (Silver), 29-inch",4.2,28,425,"Luggage","False",0
295951,"B07MBQRNKT","30"" Macro Traveler Aluminum Hardside Checked Luggage",0,0,999,"Luggage","False",0
295952,"B0C6LF72PY","Kids Luggage for Boys Girls, Cute Rolling Wheels Suitcase for Toddler, Children Travel Carry on Suitcase…",4.4,200,45.99,"Luggage","False",0
295953,"B0C9X4MMSV","Luggage Sets Hardside Lightweight Suitcase with Spinner Wheels TSA Lock, 3-Piece Set (20/24/28), Navy Blue",5,4,139.99,"Luggage","False",0
295954,"B07KY1G3W6","Paris Print Luggage with Spinner Wheels | Durable Lightweight Hardside Suitcase | Travel Bag with Handle and Trolley | 28-Inch Large Checked luggage",4.2,517,88.98,"Luggage","False",0
295955,"B0BM3PSXJQ","2023 Terminal Bag",5,4,221.05,"Luggage","False",0
295960,"B0C8JKGFFD","8 Pcs Breast Cancer Gifts for Women Large Pink Ribbon Reusable Tote Bags 18 x 16 Inches Breast Cancer Awareness Accessories for Breast Cancer Awareness Supplies",0,0,23.99,"Luggage","False",0
295961,"B08X1ZSBM7","Rolling Luggage for Kids, Cute Travel Carry on Suitcase for Boys Toddlers/Children with Wheels 18inch Dinosaur",4.6,604,59.99,"Luggage","False",0
295962,"B0C3V9GHZF","Garment Bags for Travel Leather Canvas Suit Bag with Extended Design Computer Compartment",5,6,49.99,"Luggage","False",0
295963,"B07BFTKL39","Softside 15-Inch Under The Seat Bag, Telescoping Handles, Black White Square Jacquard",4.5,45,171.95,"Luggage","False",0
295964,"B01HFH461Y","Designer Luggage Collection - Expandable 28 Inch Softside Bag for Men & Women - Durable Lightweight Checked Suitcase with 4-Rolling Spinner Wheels (28in, Global Black)",4.4,164,165.99,"Luggage","False",0
295965,"B0BC94CK96","Carry-On Luggage 18-Inch Hardside Spinner Lightweight Suitcase with TSA Lock (White)",4.4,63,129.99,"Luggage","False",0
295966,"B0C1KR4T7L","Crosslight Garment Bag in Black",0,0,270,"Luggage","False",0
295967,"B0C4T7NNV2","IMPRESSION Luggage, Suitcase with 4 Double Spinner Quiet Wheels, TSA Zipper Lock, Waterproof Compartment, 28-Inch, White",4,7,359.99,"Luggage","False",0
295968,"B000NZVZ3S","Status Roller 42L + - Black, One Size",4.4,81,210,"Luggage","False",0
295969,"B0BN4PYNYH","Pathfinder Duffel Bag, Escape Collection Travel Rolling Luggage Suitcase with Spinner Wheels",5,1,166.62,"Luggage","False",0
295970,"B0C8BRBFXH","Voyageur Just in Case® Tote",4.3,5,150,"Luggage","False",0
295971,"B0B3C5HVX2","Split Roller 110L - Woodland Floral, One Size",4.7,44,265,"Luggage","False",0
295976,"B00LHI574S","Departure Hardside Spinner Wheel Luggage Set, Owl, 2-Piece (20/28)",4.5,170,148.11,"Luggage","False",0
295977,"B09Z17DKMT","Queensbury, Rose Gold, 4 Piece",4.3,7,386.42,"Luggage","False",0
295978,"B0BXNT6HQ6","3-Piece Luggage Set with TSA Locks, Expandable, and Friction-Resistant in hot Pink- Includes 20"", 24"" & 28"" Spinner Suitcases",3.6,8,179.97,"Luggage","False",0
295979,"B095CV9132","Lightweight Canvas Duffle Bags for Men & Women For Traveling, the Gym, and as Sports Equipment Bag/Organizer",4.1,5882,14.99,"Luggage","False",100
295980,"B09XJB3NQR","Brentwood II 25"" Expandable HARDSIDE Spinner, Blue, Inch",4.3,10,114.77,"Luggage","False",0
295981,"B0B4R3PLK6","Precursor 3 Piece Softside Checked 8 Wheel Expandable Spinner, Dark Red, 3 Pc Set",2,1,349.99,"Luggage","False",0
295982,"B08RBCKWNM","3 Pieces Luggage Set. Extremely Lightweight. 20"", 24"" & 28"". Spinning Wheels. Expandable. Carry on Size Included. (Betty Leg-up)",4.7,82,199,"Luggage","False",0
295983,"B09F3542NS","Thicker Luggage Cover Elastic Suitcase Cover Protector Fits 18-32 Inch Suitcase Travel Accessories (World Map, L)",4.3,412,18.99,"Luggage","False",50
295984,"B0BQ2ZXBWX","Kids Luggage for Girls and Boys, Dinosuar Unicorn Suitcase Rolling with Wheels，Travel Carry on for Children Toddler Elementary",4.5,271,39.99,"Luggage","False",0
295985,"B083N4XXYD","Waterproof Hanging Garment Bag 40 inch Clothes Bag with Gusset, 5 Pockets & Side Zip for Dance Costumes, Sports, Skating, Theatre, Beauty Pageants, Cheer & More by Kendall Country, Lavender Purple",4.7,1405,24,"Luggage","False",50
295986,"B00F9KE5UC","Upright Wheeled Carry-On Underseater, Black, Small",4.6,4081,169.96,"Luggage","False",0
295987,"B01MYX9AEQ","Designer Luggage Collection - 3 Piece Softside Expandable Ultra Lightweight Spinner Suitcase Set - Travel Set includes 20 Inch Carry On, 24 Inch & 28 Inch Checked Suitcases (Diva)",4.4,69,259.99,"Luggage","False",0
295992,"B084BRHSV6","[Set of 2] Black Garment Bag for Travel and Storage, Breathable with Zipper and Eye-Hole, Carry Handles 26 inch x 42 inch x 5 inch",4.4,4286,19.99,"Luggage","False",50
295993,"B07TGDLB7Y","Bellagio 2.0 Spinner Trunk with Pocket - 21"" Carry On Suitcase - TSA Approved Luggage - Olive",4.4,11,715,"Luggage","False",0
295994,"B0BCPYHJVG","Large Utility Tote Bag for Women, Zip-Top Teachers Tote Bag with 12 Pockets, Waterproof Nurse Bag for Working Women",4.7,168,21.99,"Luggage","False",50
295995,"B0C9LD8SX5","3 in 1 Kids Scooter Suitcase - 3-D Hardshell Ride On Kids Luggage, Carry-on Luggage & Scooter with Wheels, LED Lights, Removable, Retractable Handle（Unicorn）",5,10,89.9,"Luggage","False",0
295996,"B06XCSKHD7","Gigabit Luggage Protector Case Clear PVC Luggage Cover Suitcase Protector Cover for Spinner Wheels Suitcase (30''(27.16''H x 19.68''L x 12.99''W))",4.3,1192,19.99,"Luggage","False",50
295997,"B0C9QZVN7R","Garment Bags for Travel",4.7,5,39.99,"Luggage","False",0
295998,"B0BYX35817","Handbag, Hydrangea Monogram Nelly Tote",4.4,16,154.7,"Luggage","False",0
295999,"B08XZMZFTG","Kids Luggage for Girls, Cute Unicorn Rolling Wheels Suitcase for Toddler Children",4.6,550,49.99,"Luggage","False",0
296000,"B07FY15QSC","Designer Carry On Luggage Collection - Lightweight Pattern 22 Inch Duffel Bag- Weekender Overnight Business Travel Suitcase with 2- Rolling Spinner Wheels (Flamingo Strut)",4.6,414,69.99,"Luggage","False",0
296001,"B0BMLS8T68","Watris Veiyi 360 Luggage Swivel Wheels Replacement, Travel Suitcase Silent Wheel Repair Set, 1 Pair A57 Suitcase Replacement Parts (Non-universal, Please check the dimensions carefully)",3.6,27,14.99,"Luggage","False",100
296002,"B01LQKPFD4","Luggage Set 4 Piece Suitcase Collection With Spinner Wheels For Woman (Wildwoods)",4.7,53,379.99,"Luggage","False",0
296003,"B08V79K6X4","3750 Hardside Expandable Luggage with Spinner Wheels, Silver, Carry-On 20-Inch",4.5,167,119.99,"Luggage","False",0
296004,"B0CCKJ5T11","Luggage Suitcase, 24 Inch Checked Luggage Hard Shell Suitcases with wheels Large Suitcase TSA Luggage Lightweight PC Hardside Spinner Luggage for Women Men(Grey)",4.8,12,159.99,"Luggage","False",0
296005,"B0C6NBC6MZ","American Girl Truly Me Honeydukes Candy Trolley for 18-inch Dolls with a Pushcart-Style Trolley and Authentic Honeydukes Pretend Sweets Ages 6+",5,2,80,"Luggage","False",0
296006,"B0BB9NSBQ5","Kids Ride-On Luggage with Wheels Suitcase Fits to Toddler Aged 3-12 Years old （Red Car Checked-Large 25-Inch",3.8,9,199,"Luggage","False",0
296007,"B074WF1DR9","Berlin Hardside Expandable Spinner Wheel Luggage Set, Charcoal, 3-Piece (20/24/28)",4.1,291,144.22,"Luggage","False",0
296008,"B0CB198BML","airline approved carry on luggage, 20 inch Aluminum Framed Suitcase with silent Spinner Wheels,Built-In TSA lock,with USB Port & Cup Holder. Lightweight hard shell carry on luggage(White)",0,0,179.99,"Luggage","False",0
296009,"B0C3HRTQ44","20 inch Carry On Luggage Wide Handle PC Hardside Rolling Bussiness Travel Suitcase With TSA Lock YKK Zipper&Silent Double Spinner Wheels (Black)",3.2,6,75.99,"Luggage","False",0
296010,"B0C4DF666G","Garment Bag for Travel, Large Suit Travel Bag with Shoulder Strap, KPIQIU Suit Carry On Garment Bags for Business Trip, Waterproof Foldable Hanging Luggage Bag for Men Women",3.9,16,23.95,"Luggage","False",50
296011,"B09W8KBW34","Premium Framed Garment Bag with Shoulder Strap and Multiple Pockets, Black, 45-inch",4.6,5,163.79,"Luggage","False",0
296012,"B0BH69TY7L","Ascella 3.0 Softside Expandable Luggage with Spinners | Light Plum | 2PC SET (Carry-on/Medium)",4.5,44,359.99,"Luggage","False",0
296013,"B0CDQ1M5XJ","Rolling Carry On Underseat Luggage with Wheels & USB Port, Wheeled Spinner Under seat Suitcases for Airlines, Lightweight Luggages Men Women, Pilots and Crew (16-Inch)",5,1,79.99,"Luggage","False",0
296014,"B0C51SPWFQ","2 Wheel Underseater",4.6,3,200,"Luggage","False",0
296015,"B0CCDPZ655","Trunk Spinner Luggage Sets 3 Piece (20/25/29)"" PP Hardside Luggage with Double Spinner Wheels, Lightweight Travel Suitcase Set with TSA Lock Upgraded Burst Resistant Zipper, Black",4.8,8,209.99,"Luggage","False",0
296020,"B0BCPGDTD5","Intrepid 22"" Softside Carry-on 8 Wheel Expandable Spinner with TSA Lock, Dark Red",4.2,5,99.33,"Luggage","False",0
296021,"B089HQ7V6N","Chariot Gatsby 2-piece set Hardside Expandable Carry On Luggage With Matching Beauty Case (Ice Blue)",4.4,150,149.99,"Luggage","False",0
296022,"B0BBR3GGW4","3 Pieces Clear PVC Suitcase Protector Waterproof Cover for Luggage TSA Approved Luggage , 24 Inches, 28 Inches, 30 Inches (Black Border)",3.6,60,19.98,"Luggage","False",50
296023,"B0C412LFXK","Rupees Rupee Set Of 60 Pieces With Bag Included",3.9,18,12.99,"Luggage","False",100
296024,"B0C1VVB8DV","Luggage Expandable 3 Piece Sets Rare Color PC+ABS Suitcase Set with Smooth wheels and TSA lock…",4.6,42,179.97,"Luggage","False",0
296025,"B09XJ9C139","Brentwood II Expandable HARDSIDE Spinner, Blue, 29-Inch",4.1,12,139.99,"Luggage","False",0
296026,"B0C5XVRCX8","Trolley case portable trolley bag boarding case small bag small light luggage suitcase for men and women (Carry-On 18 Inch)",5,2,149.99,"Luggage","False",0
296027,"B09M971RXD","60” Premium Tri-Fold Travel Garment Bag with exterior pocket",4.3,46,74.79,"Luggage","False",0
296028,"B099P4NT9K","20-inch Carry-on Rolling Duffle Bag",4.3,116,39.95,"Luggage","False",0
296029,"B07K58DFCR","Bowen Messenger",4.9,19,74.72,"Luggage","False",0
296030,"B07VVPTVVX","Kids Carry On Luggage Children Rolling Suitcase with 4 Wheels Hardshell Case for Toddler baby Travel (Unicorn)",4.7,584,69.99,"Luggage","False",0
296031,"B0CC4FVDSJ","Luggage Sets 3 Piece (20/24/28 inch)-Carry On Suitcase-Suitcase With Wheels-PC+ABS - Hardside Spinner Travel Luggage (Metallic Grey, 3 Pcs Set)",0,0,193.19,"Luggage","False",0
296036,"B0BRCLWN3L","Vintage Style Luggage Set 3 Piece, TSA Lock, Spinner Wheel, 26"" Check-In, 20"" Carry-On, 12"" Boarding Tote",4.4,10,331,"Luggage","False",0
296037,"B08NLVD6RV","Bromley 15-Inch Under The Seat Bag, Black",4.3,40,167.49,"Luggage","False",0
296038,"B08NCN29J3","Palm Tree Hardside 2-Piece Carry-On Spinner Luggage Set, One_Size",4.6,139,104.98,"Luggage","False",0
296039,"B0BLSBB9LZ","Washable Luggage Cover - Fashion Suitcase Protector Fits 27-30 Inch Luggage (Black, L)",4.3,1165,15.99,"Luggage","False",50
296040,"B092438RKP","Vintage Luggage Set of 2 Pieces with TSA Lock Cute Retro Trunk luggage (Green, 14inch & 28inch)",4.4,138,259,"Luggage","False",0
296041,"B0C5RR94F8","Garment Duffle Bags for Travel,Moulyan Convertible Carry on Garment Bag with Shoe Compartment,3 in 1 Waterproof Travel Suit Bag with Shoulder Strap for Men Women",4.6,19,39.86,"Luggage","False",50
296042,"B0C65DFF78","Canvas Tote Bag for Wedding, Holiday, Beach, Shopping| Unique Retirement Gifts Best Friend Birthday Gifts for Women",4.8,16,22.99,"Luggage","False",50
296043,"B09R3TK9N9","Malibu Bay 3.0 Softside, 4 Wheel Spinner, Lightweight Suitcase, Unisex, Stylish, Gray, Carry-On 20-Inch",4.3,27,139.99,"Luggage","False",0
296044,"B0CC6L1MH4","Duffle Bag Set for Kids - 4 Pc Bundle with Hello Kitty Luggage Carry On Suitcase Bag, Water Bottle, Stickers, and More | Hello Kitty Travel Bag Set",0,0,24.96,"Luggage","False",50
296045,"B01NBW8V51","Women’s Dress and Gown Garment Bag -72”x24” and 10” Tapered Gusset -Your Bags",4.5,2337,15.99,"Luggage","False",50
296046,"B0CBLN2FYF","MONOMARK 60"" Dress Bags for Gowns Long, Garment Bags for Hanging Clothes, 6.5"" Gussetes Dress Garment Bag, Clear Foldable Long Dress Bag for Closet Storage and Travel, 3 Pack",4.6,308,22.99,"Luggage","False",50
296047,"B0B3J1C1GY","Voyageur Sidney Leather Business Tote - Dark Mauve",5,1,499,"Luggage","False",0
296052,"B072KG3876","Women's Luggage Marie 29"" Hardside Check in Spinner, Telescoping Handles, Black Floral Print, One Size",4.3,380,159,"Luggage","False",0
296053,"B097CRQ3ZZ","Suki Hardside Spinner Check in Luggage 29"", Light Grey/Neon",5,5,179.99,"Luggage","False",0
296054,"B0BLT4R8W1","Women's Suitcase Spinner Wheels Hardside, Deep Black, One Size",5,1,199.99,"Luggage","False",0
296055,"B0CCS27K3Y","Clear Suitcase Cover, 28 Inch Travel Thicken Luggage Cover Protector, Luggage Covers for Suitcase Fully Transparent Luggage Protector Dustproof (28"" H x 19.5"" L x 13.4"" W)",0,0,16.99,"Luggage","False",0
296056,"B00U7U1K48","Handbag, Pebble Grain Small Lexington Tote",4.7,149,219.7,"Luggage","False",0
296057,"B0C2XDH7SR","Carry on Garment Bags – Large Travel Suit Bags Weekend Bag, Convertible Garment Duffel Bag with Shoe Pouch for Men Women, Gray",4.5,2,29.99,"Luggage","False",0
296058,"B07WR1NFSY","Reaction Rugged Roamer Luggage Collection Lightweight Softside Expandable 8-Wheel Spinner Travel Suitcase Bag, Black, 28-Inch Checked",4.3,372,149.99,"Luggage","False",0
296059,"B07F6HPFDY","Women’s Dress and Gown Garment Bag -72”x24” and 10” Tapered Gusset Prom Bags (Black & White Dress)",4.7,200,16.89,"Luggage","False",50
296060,"B0BWG8VNBN","Horizontal Duck Bag - Tamarind",5,2,38,"Luggage","False",50
296061,"B0883CW6VG","Women's Microfiber Small Vera Tote Bag",4.8,830,105,"Luggage","False",0
296062,"B0BMTP6V6J","4 Piece Luggage Sets, Travel Suitcase, Large Capacity Lightweight Luggage Sets with TSA Lock & Spinner Wheels, for Business, Travel, School Starts (16""/20""/24""/28""), Rose Gold",3.8,49,129.99,"Luggage","False",0
296063,"B07P27HYYW","Baggallini BG Austin Tote - Lightweight, Water Resistant, Carry-On Travel Purse With Zippered Pockets, Adjustable Strap, and Luggage Sleeve, Black",4.6,315,59.99,"Luggage","False",0
296064,"B088ND9SNC","3 Piece Vintage Suitcase Set, Handcrafted Retro Luggage with TSA Lock and Carry On Cosmetic Train Case, Faux Leather Trunk Suitcase with Spinner Wheels for Women, Embossed Pink, 26""+20""+12""",4.4,68,398.89,"Luggage","False",0
296065,"B07CB7L6NZ","Women's Vivian 21"" Spinner, Marble Web, One Size",4.6,117,139.99,"Luggage","False",0
296067,"B09CTX3XBN","Kids' Luggage, Dino, One Size",4.6,489,56,"Luggage","False",0
296068,"B0CBT52L62","Signature 20-Inch, 24-Inch, 28-Inch Hard Side Suitcase Luggage with Spinner Wheels, Black, 24-Inch",0,0,59.99,"Luggage","False",0
296069,"B0BD9BRY4C","Carry on Luggage 21 Inch with Front Pocket, ABS+PC Hardshell Suitcase with Dual Control TSA Lock, YKK Zipper, 4 Spinner Silent Wheels, Dark Green",4.3,211,105.99,"Luggage","False",0
296070,"B0B5HC416L","1 Pair Luggage Replacement Wheels, Replacement Luggage Suitcase Spinner Wheels, Swivel Suitcase Wheels Suitcase Wheel Repair Replacement Luggage Wheels for Luggage",3.2,23,23.69,"Luggage","False",0
296071,"B0B3CWGBDP","Split Roller",4.8,30,178.5,"Luggage","False",0
296072,"B079SGB57P","Atlantic Ultra Lite Softsides Rolling Underseat Carry-on, Turquoise Blue, One Size",4.2,324,79.99,"Luggage","False",0
296073,"B0BVM49DRP","3 in1 Garment Bags for Travel,Convertible Garment Duffle Bags with Shoe Compartment,Detachable Hanging Suit Bag,Sports Gym Duffle Bag with Toiletry Bag for Men Women(Black)",4.3,80,44.99,"Luggage","False",0
296074,"B00GXC69XG","Conventional II Softside Expandable Rugged Rolling Upright Suitcase, Lightweight Travel Luggage, Black, Checked-Large 30-Inch",4.1,73,124.62,"Luggage","False",0
296075,"B00VFQTOGY","Lite-Shock Suitcase, 75 cm, 98.5 Liters, Sand",4.6,1661,429.8,"Luggage","False",0
296080,"B0C851KC22","Luggage Sets 3 Piece, Softside Lightweight Expandable Luggage Sets with TSA Lock, Carry On Luggage with Spinner Wheels for Women Men, Travel Suitcase Lightweight (20/24 / 28, Brown)",4.8,7,109.99,"Luggage","False",0
296081,"B079VMDZS4","Accents Kit - Cherry",4,38,125,"Luggage","False",0
296082,"B01MXXJ4VK","Platinum Elite Tri-Fold Carry-On Garment Bag, Men and Women, Rich Espresso, 20-Inch",4.3,102,229.49,"Luggage","False",0
296083,"B0BB895QFJ","Dreamworld 18"" Hardside 4 Wheel Carry On Spinner, Purple",4.8,12,95,"Luggage","False",0
296084,"B09XJ989DX","Brentwood II 20"" Expandable HARDSIDE Spinner Carry-ON, Blue, Inch",4.5,30,104.59,"Luggage","False",0
296085,"B0CB3FZ29M","Expandable Luggage Sets with Double Spinner Wheels, 3 Piece Hard Suitcase Set for Short Trips and Long Travel, Blue",4.4,43,179.99,"Luggage","False",0
296086,"B072HD1KDM","Utility Tote with Pockets & Compartments-Perfect Nurse Tote Bag, Teacher Bag, Work Bags for Women & Craft Tote",4.7,6019,39.97,"Luggage","False",0
296087,"B08R9WBZC5","Vintage and Cute Carry-on Overnight Case Non-wheeled Mini Leather Trunk Suitcase with Shoulder Strap",4.7,169,109,"Luggage","False",0
296088,"B0949B8KJ8","365 Carry On Roller 40L - Carbon, One Size",3.7,11,140,"Luggage","False",0
296089,"B015DC26G0","Impact Softside Spinner Wheel Luggage, Charcoal, 4-Piece Set (18/22/26/30)",4.1,982,169,"Luggage","False",0
296090,"B00NP9NWQ2","Shoreleave 2020 Version: Compartmentalized Rolling Luggage",4.4,71,269.99,"Luggage","False",0
296091,"B07BS4PBLH","Luggage 24"" Expandable Design Pattern Suitcase With Spinner Wheels For Woman (24in, Trop Pineapple)",4.7,533,149.99,"Luggage","False",0
296096,"B07TWVYSDR","Women's Hardside Rolling Suitcase Luggage, Bloom Boom Navy, 22"" Carry On",4.4,9,206.5,"Luggage","False",0
296097,"B0C6NV1DXM","On the Go 4 Piece Travel Bundle, Includes 21"" Rolling Suitcase, Packable Large Tote, Medium & Small Pouches, Rainbow Wanderlust",0,0,169,"Luggage","False",0
296098,"B0CFL93Y9M","OCEAN HOLIDAY Luggage with Double Spinner Wheels, Hardside, 24 Inch, Quiet, TSA Lock Suitcase, Soft Sand",0,0,0,"Luggage","False",0
296099,"B0BLC8ZTLM","Large Collapsible Foldable Suitcase with Spinner Wheels Expandable Rolling Luggage Bag Carry On Wheeled Suit Case Maletas De Viaje Para Grandes Con Ruedas 50 Libras Ultra Lightweight Airline Approved",4,21,49.99,"Luggage","False",0
296100,"B0C77WYZ1R","Zilink 60"" Long Garment Bags for Travel Waterproof Garment Bag for Dresses Long Hanging Dress Bags for Closet Storage with Adjustable Handles and Stable Buckles for Suit Coats Tuxedos Dresses, Black",4.4,869,41.99,"Luggage","False",0
296101,"B0B49N73SR","Alpha Bravo Retreat Tote - Sand",5,2,396.99,"Luggage","False",0
296102,"B0B95VRMDY","Duck Bag Canvas Tote, Essential Everyday Tote, Spacious and Roomy",4.7,1738,38,"Luggage","False",0
296103,"B0B7QZKQH1","Utility Tote 2.0, Wonder Beige, One Size",5,2,43.99,"Luggage","False",0
296104,"B0BXFBQ3QD","Biaggi Curve - 2 in 1 Wheeled Carry On and Garment Bag 22-Inch Foldable Luggage, As Seen on Shark Tank | | 22"" x 12"" x 11"" | 4 lbs | Compact and Lightweight"" (Purple)",4.3,6,179.99,"Luggage","False",0
296105,"B08MR35D5F","Ricardo Mojave Hardside Carry-On in Platinum",4.5,73,139.99,"Luggage","False",0
296106,"B09VYNB6Z4","Encompass 27"" Hardside Checked 8 Wheel Expandable Spinner, Cream",4.5,14,119.99,"Luggage","False",0
296107,"B0B9XYVLWH","Weekender Bag for Women, Heavy Duty Travel Tote Bag Sports Gym Bag Foldable Carry On Bag Large Overnight Bag",4.7,649,15.99,"Luggage","False",100
296112,"B0BGP3VMW2","2 Piece Luggage Sets, Expandable 20 inch Carry on Luggage Airline Approved, Lightweight Carry on Suitcase with Spinner Wheels, Family Travel Suitcase Set with Duffle Bag",4.1,41,95.99,"Luggage","False",0
296113,"B0C98JDKP7","Carry on Luggage Airline Approved, 20-Inch PC Hardside Suitcase TSA Lock with Spinner Wheels(Beige with brown)",0,0,109.99,"Luggage","False",0
296114,"B0BKQ4TRLL","55x40x20cm Velocity Suitcase 4 Wheel Luggage Cabin Bags 55 x 40 x 20 Suitable for Ryanair, Easyjet, Jet 2 Paid Carry On, White, 55x40x20, Carry on suitcase 55x40x20… (White)",4.6,466,139,"Luggage","False",0
296115,"B07VB9LYLG","Kanken Totepack Mini Backpack with Tablet Sleeve for Everyday Use and Travel",4.6,167,84.95,"Luggage","False",0
296116,"B0BC22QWH5","VOHEN Garment Bags for Travel - Stylish and Durable Travel Bag for Suits, Dresses, and More - Suit Bag with Interior Pocket and Heavy Duty Zipper",5,1,164,"Luggage","False",0
296117,"B0C2YM1XZ5","Carry On Luggage, Lightweight Suitcase with Cup Holder, Airline Approved Hardside Luggage, 8 Spinner Wheels Rolling Luggage for Weekender Overnight Business Travel (Black, Carry-On 20-Inch)",4,1,179.99,"Luggage","False",0
296118,"B0BTQ4XT37","Alpha Bravo Continental Front Lid Expandable 4 Wheel Carry On - Black",0,0,850,"Luggage","False",0
296119,"B0B3CFDWTW","Split Convertible Roller",4.1,6,178.5,"Luggage","False",0
296120,"B0BTQ6C2ZB","Alpha Bravo International Front Lid Expandable 4 Wheel Carry On - Black",0,0,775,"Luggage","False",0
296121,"B0BQMFNNH8","Flower Lette M Black Luggage Cover Elastic Washable Stretch Suitcase Protector Anti-Scratch Travel Suitcase Cover for Kid and Adult L (25-28 inch suitcase)",4,92,21.1,"Luggage","False",50
296122,"B0B5K2GRZN","Luggage Sets 3 Pieces Carry on Suitcase Hardshell Lightweight Travel with Double Spinner Wheels Locks TSA Approved (Green)",4.5,97,179.99,"Luggage","False",0
296123,"B09Y53B1GZ","AOODA 60"" Trifold Dress Garment Bags for Travel, Gusseted Hanging Clothes Storage Bags with Clear Zipper Pockets for Accessories (Grey)",4.5,156,9.99,"Luggage","False",100
296124,"B0BLSG22DP","Garment Bag for Travel,Large Hanging Luggage Garment Bag Suit Bag Carry On Garment Bag Dress Bag",4.3,31,37.99,"Luggage","False",0
296125,"B08TPBVY8L","Cotton Utility Travel Bag",4.5,241,91.2,"Luggage","False",0
296126,"B0C8W3CXJK","Women's Hardside Underseat Rolling Suitcase Luggage, Fresh-Cut Floral Green, One Size",4.6,19,235,"Luggage","False",0
296127,"B0CCB124LB","Carry On Hard Shell Luggage Sets 2 Piece with Spinner Wheels,Expandable Suitcase with TAS Lock,3-Layer PC Texture (White, 13-inch/20-inch)",0,0,189.99,"Luggage","False",0
296128,"B096JZMXD6","80L Check In Travel Case – Full Aluminum Luggage, Italian Leather Handles",5,1,1995,"Luggage","False",0
296129,"B0BSC1V7JD","Women's Spontaneous 31-Inch Softside Spinner Wheel Luggage, Integrated TSA Accepted Lock, Metallic Glow, One Size",5,2,298.95,"Luggage","False",0
296130,"B09VTJ6PF2","Chelsea 20"" Expandable Spinner, Rose Gold, Carry Inch",4.4,18,0,"Luggage","False",0
296131,"B0C3V7KYX2","Luggage Wheels Replacement Kit,Spinner 360 Degree Wheels for Travel,Suitcase Plastic Repair Wheel Set, Mute Wheels Pack of 2",0,0,17.99,"Luggage","False",50
296132,"B0B7QGHQ1L","Utility Tote 2.0, Black, One Size",5,1,50,"Luggage","False",0
296133,"B0B9HVG12B","Summer Spots 34"" Softside Checked 8 Wheel Lightweight, Red",3.4,4,141.24,"Luggage","False",0
296134,"B0BN6WJRM5","Census 22"" Softside Carry-On 8 Wheel Spinner, Soft Pink, 21""",4.4,4,104.99,"Luggage","False",0
296135,"B07Y52NVGD","Large Travel Duffel Bag for Women,Weekend Tote Bag,Waterproof Sports Gym Bag with Separate Wet Pocket,Weekender Carry on Overnight Hospital Shoulder Bags for Labor and Delivery,with Trolley Sleeve",4.6,1804,17.99,"Luggage","False",50
296140,"B09XJ9F11N","Brentwood II 15"" 2-Wheel Under The Seat Bag, Blue, Carry Inch",4.6,48,130.48,"Luggage","False",0
296141,"B09TFHV94H","3 Piece Luggage Set Lightweight Hardshell Travel Checked Rolling Suitcases with TSA Approved Spinner Wheels 3-Digit Combination Lock, Light Blue",4.3,22,109.99,"Luggage","False",0
296142,"B0BVC7TFJM","8020 Hardside Expandable Luggage with Spinner Wheels, Ultimate Grey, Checked-Large 27-Inch",3.9,36,149.99,"Luggage","False",0
296143,"B09YJ5BX4M","Oxford III Cabin Bag, Black-White, Carry-On 17-Inch",4.4,22,0,"Luggage","False",0
296144,"B09H3JDPQM","HORNBAEK Woven Tote Bag 08",4.6,32,96.95,"Luggage","False",0
