"uid","asin","title","stars","reviews","price","category","isBestSeller","boughtInLastMonth"
298291,"B0BVNVDSMG","Voyages Hardside Luggage with Spinner Wheels, Anthracite, Carry-On 19 Inch",0,0,445,"Luggage","False",0
298292,"B0C69DGWCH","Clear Luggage Cover Protector Bag PVC Suitcase Cover Protectors Transparent Luggage Protector Waterproof Dustproof for Travel (28 Inch)",0,0,13.09,"Luggage","False",0
298293,"B09XXW182J","Mesh Beach Tote Bag for Women Big Capacity Shoulder Handbags Pool Bag for Shopping Picnic Travel Essentials",4.7,428,14.88,"Luggage","False",0
298294,"1639470158","Cavallini & Co. Jellyfish Tote Bag",5,1,28.9,"Luggage","False",0
298295,"B0C373MZ3W","3 Pcs PVC Clear Suitcase Cover Large Travel Luggage Cover Waterproof Luggage Cover Protector for 28 Inch Wheeled Suitcase, 27.1 x 19.6 x 12.2 Inches",2.9,5,16.99,"Luggage","False",0
298300,"B09QRSXHF4","Van Gogh Reusable Art Tote Bag, Aesthetic Canvas Carry on Shoulder Tote, Women Work Beach Travel",4.7,7,6.99,"Luggage","False",0
298301,"B0C6LQ3VT2","Luggage Cover for Suitcase 26-28 Inchs, Premium Zipper Close Protect and Personalize Your Luggage - Cute Cat",0,0,20.99,"Luggage","False",0
298302,"B0C8ZQY494","3 Packs Clear Inner Bags for Bogg Bag Rubber Beach Tote Bag, Zippered Insert Bag with holes, Suitable for travel holiday beach must have (black)",0,0,12.99,"Luggage","False",0
298303,"B07P9RT2BL","Lightweight 8 Wheel 1680D Soft Case Suitcases Maximum Size For Delta, United and SkyWest Airlines - Cabin Charcoal FFK0041_S",3.6,20,49.99,"Luggage","False",0
298304,"B0CCXWLP53","2023 NEW Jacquard Embroidery Luxury Fashion Tote Bag with Zipper Cotton Linen Large Handbag Retro Exquisite Bag",0,0,22.99,"Luggage","False",0
298305,"B0B67P1XTV","Garment Bag for Dancers Kids with Gasset, 40 inch Clear Waterproof Hanging Dance Garment Bag with Pockets, Handle for Dance Costumes, Dress Cover Purple-1pk",5,2,19.99,"Luggage","False",0
298306,"B079ZJN5WJ","Suitcase, Peony, XL (75 cm-94 L)",4.5,251,500.35,"Luggage","False",0
298307,"B0CBMCRVBJ","Hardside Luggage Sets Double Spinner 8 Wheels Suitcase with TSA Lock Lightweight, Blue, (20/24/28)",0,0,134.99,"Luggage","False",0
298308,"B07BMSVLJL","24 inch 68 cm Hardshell Check-in Size Suitcase, Navy Blue",4.6,2247,105.69,"Luggage","False",0
298309,"B09KTV48CS","Continental Expandable 4 Wheel Carry-On Hibiscus One Size",5,1,0,"Luggage","False",0
298310,"B0CFMWKP4V","7AM Enfant Wrap Top",0,0,36,"Luggage","False",0
298311,"B0CBBBPBHV","Initial Jute Tote Bag & Makeup Bag Embroidery Monogram Tote Bag with Strap Personalized Birthday Gifts for Women",0,0,25.99,"Luggage","False",0
298316,"B0B5HSTSPZ","Tote Bag",4.2,3,24,"Luggage","False",0
298317,"B0CCDZKVBS","Accessories for Bogg Bag Handbag Beach 1",4.6,13,7.99,"Luggage","False",0
298318,"B003MLK4VE","Campus M 25L - Gravity Grey, One Size",4.6,4,75.75,"Luggage","False",0
298319,"B099NDZTV6","Travel Luggage Cover Abstract Colorful Dog Paw Print Luggage Suitcase Protector Baggage Fit 29-32 Inch",4.2,23,19.98,"Luggage","False",0
298320,"B0C3H92853","3 Pcs Clear Luggage Cover PVC Waterproof Suitcase Cover Dustproof Travel Suitcase Protector Cover with Velcro,20 Inch",3.3,5,15.99,"Luggage","False",0
298321,"B07DZWWYB3","Women Large Tote Top Handle Shoulder Bags Llama Pattern With Stripes Ladies Handbag",4.5,454,11.49,"Luggage","False",0
298322,"B0BC1KXWZW","Ugiftcorner Teacher Tote Bag Teacher Gifts for Women Men Teacher Appreciation Gifts Christmas Graduation Valentines Day Birthday Thank You Gifts for Teacher Bag Canvas Cotton Bag with Pocket Black",4.6,73,14.99,"Luggage","False",0
298323,"B084X5SM37","3D Print Design Travel Suitcase Protector Trolley Case Cover 19""-30"" Sleeve (M(Fits to 22""-24"" Trolley Case), Giraffe(New Version))",4.3,623,17.99,"Luggage","False",0
298324,"B0C4NR75R2","Luggage Cover For Travel Cover Suitcase Protector Colorful Elastic 18-32 Inch Suitcase Cover Sets For Luggage Accessories (Vintage Bird, XL)",5,1,21.99,"Luggage","False",0
298325,"B0C18R16P4","Kate Bosworth Tote Bag Sunburn Positivity Paradise One Size",5,1,0,"Luggage","False",0
298326,"B08P45M8C1","Reusable Tote Bag Women Large Casual Handbag Shoulder Bags for Shopping Groceries Travel Outdoors",4.7,138,23.99,"Luggage","False",0
298327,"B0B1S8RQY7","Big Canvas Bag with Pocket, Lightweight Reusable Travel Tote for Books, Beach or Produce",4.7,20,19.95,"Luggage","False",0
298332,"B0C5QHM2SN","PT Gift Physiotherapy Gift Physical Therapist Graduation Gift Physical Therapist Definition Physical Therapy Tote Bag",0,0,16.89,"Luggage","False",0
298333,"B0C33SHJP9","Tinker Bell Neverland Gift Magic Kingdom Gift Cartoon Movie Merchandise Tote Bag",5,1,15.89,"Luggage","False",0
298334,"B083SBRPLJ","Travel Bag Carry On Sports Gym Duffel Luggage Shoulder Pack for Women (Black) Medium",4.6,161,19.99,"Luggage","False",0
298335,"B0B49Y1R22","Stamp Pattern Travel Luggage Covers Thicken Elastic Suitcase Protector Fit for 26""-30"" Inch Luggage",5,1,19.99,"Luggage","False",0
298336,"B081S8L321","Britto Transparent 21"" Carry On Spinner Luggage (Transparent Butterfly)",4,19,161.99,"Luggage","False",0
298337,"B0CFBGRWGV","Charms for Bogg Bag Accessories Charm Insert, 4pcs Rubber Beach Bag Accessories for Simply Southern Bogg Bags, Decoration Charms",0,0,9.99,"Luggage","False",0
298338,"B07SDGDH52","Sparkle Expandable Tote, Black, One Size",0,0,27.17,"Luggage","False",0
298339,"B0BRQDZYLT","Multiple Myeloma Awareness Cosmeic Make Up Bag Cancer Warrior Gift Multiple Myeloma Awareness Ribbon Make Up Zipper Pouch Bag (Multiple Myeloma Awareness)",0,0,13.89,"Luggage","False",0
298340,"B07P7HM5MH","Prosperous 28"" Hardside Checked 8 Wheel Expandable Spinner, Metallic Blue",5,2,149.99,"Luggage","False",0
298341,"B0BRN6NBVT","Travel Bag with Wheels",4.3,56,106.35,"Luggage","False",0
298342,"B099WH23QH","Dry Wet Separated Tote Bag Gym Tote Sports Bag Lightweight Travel Duffel Bag Water-Resistant Beach Tote for Men and Women (Black Leaf)",4.5,65,15.99,"Luggage","False",0
298343,"B0BZX9S6X9","Heys Nickelodeon Paw Patrol Lightweight, Zipper Closure System Kids Luggage with Inline Skate Wheels and Telescopic Trolley Handle System",0,0,80.99,"Luggage","False",0
298344,"B0C85K328T","Foldable Work Tote Bags For Women Large Tote Travel Bag, Nurse Bag, Teacher Bag, Mom Bag",4.4,53,15.99,"Luggage","False",0
298346,"B09NZL55L8","Peanuts Snoopy with Woodstock Decorate the Tree Reusable Tote Bag ''Merry Christmas'' - 13.5 x 15 Inch",0,0,6.99,"Luggage","False",0
298347,"B09SGPPWM6","Travel Garment Bag Premium Tri-Fold Exterior Pocket, Black-M1 Gold, 60-Inch",4.2,3,90.57,"Luggage","False",0
298348,"B0BQHDBZNS","10 Pieces and So the Adventure Begins Canvas Tote Bride Bag Inspirational Gift for Bridal Shower, Bachelorette Party, Engagement, Wedding, Graduation, Tote with Zipper Pocket for Women BFF Friends",0,0,17.59,"Luggage","False",0
298349,"B0BZ1744CM","A Girl Loves Pandas Tote Bag for Women Personalized Beach Bag Canvas Bag Funny Panda Gifts for Girls Women Animal Lovers Best Friends Graduation Birthday Wedding Travel Camping Christmas",0,0,13.99,"Luggage","False",0
298350,"B0CC9JXYTN","Bling Charms for Bogg Bag＆Simply Southern Totes, Beach Bag Charm Insert Bits Accessories",2.5,3,16.99,"Luggage","False",0
298351,"B09XR744NL","Aluminum frame, Durable Hardside Japanese elegant luggage with corner pads protection, double spinner wheels, Carry-on, 21 inch, Navy Carbon, 5507-48-NVCB",5,2,229,"Luggage","False",0
298352,"B076KYMXYC","Unisex-Adult (Luggage only) Bursts 8-Wheel Spinner, Multi, 26"" Hardside Luggage",4.6,23,122.89,"Luggage","False",0
298353,"B00JTOO770","Derek Alexander NS Top Zip Tote, Black, One Size",5,3,40.64,"Luggage","False",0
298354,"B0C1RZV5V9","Yoga Tote Bag Yoga Lover Gift Yoga Instructor Gift Yoga Teacher Gift Meditation Gift Zen Gift",3.4,4,16.89,"Luggage","False",0
298355,"B0B53CW9BQ","Wolf Printing Suitcase Covers For Women Dust-proof Washable Luggage Protector Fit 18-32 Inch Baggage",5,1,23.99,"Luggage","False",0
298361,"B08MT66QL5","EcoRight Large Tote Bag for Women for Travel, Work, Beach | Waterproof & Eco Friendly",4.1,198,0,"Luggage","False",0
298362,"1577666135","The Magic Garment: Principles of Costume Design",4.5,45,69.39,"Luggage","False",0
298363,"B0C3X8HVZQ","License Plates Suitcase Cover Old Car License Plates on The Wall Luggage Covers for Suitcase Colorful Printed Elastic Luggage Sleeves or Covers Travel Accessories Fit 22-24 Inch Luggage",4,1,19.99,"Luggage","False",0
298364,"B0BZVNYF42","Beach Bag for Women, Waterproof Beach Tote Bag Eaxtra Large Travel Tote PEVA Lining Sandproof Swim Pool Bag",5,2,26.99,"Luggage","False",0
298365,"B08412RF2J","Keane Spinner Suitcase, Charcoal, Carry-On",3.2,3,69.98,"Luggage","False",0
298366,"B0C3X98TCC","African American Woman Girl with Crown Travel Luggage Cover Black Women Colorful Graffiti Hair Art with Positive Words Suitcase Cover Protector Elastic Baggage Case Covers Fit 22-24"" Luggage",0,0,19.99,"Luggage","False",0
298367,"B0BC42NXYZ","Garment Bag for Travel, Convertible Carry on Garment Bag with Shoe Compartment & Storage Bin, Large Garment Duffle Bag for Men Women Business Wedding, 2 in 1 Hanging Suit Bags for Travel",4.5,120,0,"Luggage","False",0
298368,"B0CFPYFHX2","Murder TV Show Inspired Tote Bag Jessica Fletcher Fans Gifts Jessica Fletcer Tote Bag True Crime Lover Gift",0,0,14.89,"Luggage","False",0
298369,"B09Z7JQVNY","Attuned 28"" Hardside Checked 8 Wheel Expandable Spinner, Pale Mauve",3.2,5,102.43,"Luggage","False",0
298370,"B0BLCNS6HT","Margot Quilted Tote Pink Clay One Size",0,0,58.32,"Luggage","False",0
298371,"B0C2YQXQ15","Into Woods Tote Bag Into Woods Musical Tote Into Woods Musical Merch Into Woods Quote",0,0,16.89,"Luggage","False",0
298376,"B09X25Q1D5","Women's Bistrot Brilliant 5 Piece Set",5,1,95,"Luggage","False",0
298377,"B00004SR9S","Travel Garment Bag Cover for Airplane, Car, Everyday Use-Heavy-Duty, Lightweight, Water-Resistant, Perfect for Suits, Dresses, or Uniforms, 47” Length, Black, One Size",4,288,13.5,"Luggage","False",50
298378,"B083S6SSFZ","Disney's Villains Maleficent Scar Ursula the Witch Cruella Deville Large Reusable Tote Bag …",4.1,12,14.95,"Luggage","False",0
298379,"B0B4P5QBJ1","Recruiter Make Up Bag HR Department Gift Idea I Will Recruit You And I Will Hire You Make Up Zipper Bag For Hiring Manager (I Will Recruit You)",5,2,13.89,"Luggage","False",0
298380,"B0987PK3C7","Men's Cabin Suitcase, Blue, 38x55x20 cms",0,0,96.91,"Luggage","False",0
298381,"B0C4PQ2MBH","BIGCARJOB Cute Paw Luggage Handle Covers Set for Suitcase,Set of 2 Pcs Lovely Footprint Door Handle Protection Sleeve Cover Luggage Makers Covers Wraps Travel Accessories for Women Girls Gifts",4.6,13,9.99,"Luggage","False",0
298382,"B01EFOHDHY","Picnic at Ascot Large Insulated Multi Pocketed Travel Bag With 6 Exterior Pockets, Trellis Green",4.7,31,35,"Luggage","False",0
298383,"B0C3LWXBDN","Washable Travel Luggage Protective Cover Suitable Protector For Different Sizes Luggage (Black, L(26-28 inch luggage))",5,2,16.99,"Luggage","False",0
298384,"B0914PDZH7","Genuine Tote Bag",4.3,68,14.95,"Luggage","False",0
298385,"B073SHPW82","Brandy Hb17315, Brown, One Size",5,1,58.38,"Luggage","False",0
298386,"B0C8MK5TZ8","WORBSS 5Pack Beach Bag Charms Accessories - Decorative Set for Bogg Bags - Diy Charm for Beach Totes with Holes - Fashion Designer Gifts for Women Girls - Embed 5.5 Inch Upgraded Buttons Prevent Loss",5,1,9.98,"Luggage","False",0
298387,"B08Z37V75X","Suitcase Wheel 2Pcs Universal PVC Luggage Swivel Casters Wheels Luggage Suitcase Trolley Wheels",4.5,2,16.39,"Luggage","False",0
298392,"B0C5T3S2CJ","Gift Occupational Therapy Worker Gift, Therapist Tote Bag, Rainbow Tote Bag OTs Make the World A Better Place OT Gift Tote Bag 13ST01",0,0,12.99,"Luggage","False",0
298393,"B0CC2B4M3L","Paraprofessional Tote Bag Paraprofessional Appreciation Beach Bag Paraeducator Gifts Teaching Assistant Gifts Handbag",0,0,19.99,"Luggage","False",0
298394,"B0B99L1538","Jumbo 22"" Hardside 8 Wheel Expandable Spinner, Dark Gull Grey",5,1,101.55,"Luggage","False",0
298395,"B082SMSLFP","Business Card Holder, Aluminum Credit Card Holder with RFID Blocking Sleeves, Pockets Colorful Aluminum Business Card Cases for Men Women.",4.1,495,5.99,"Luggage","False",0
298396,"B0BXS8BDDW","3 piece Hard Shell Luggage Sets Suitcase Set, PC+ABS Lightweight Hardside Travel Suitcase with Spinner Wheels & TSA Lock for Women Men (20/24/28 inch)",3.9,11,168.8,"Luggage","False",0
298397,"B0CBJY6BJ3","Mom Cotton Canvas Tote Bag New Mama Gift Best Mom Ever Bag Dog Mom Tote Shopping",5,1,24.95,"Luggage","False",0
298398,"B07SGPNWRG","Santa Barbara Design Studio Hold Everything Waterproof Jute Tote Bag, Mini, Beach",4.5,19,26.99,"Luggage","False",0
298399,"B0C7HDN2PV","20 24 28 30inch Luggage Cover Suitcase Protector Cover Luggage Protector Suitcase Cover Travel Luggage Sleeve PVC Protector Cover (Transparency, 30inch)",0,0,17.99,"Luggage","False",0
298400,"B007IFOADI","Sedona 100% Pure Polycarbonate Expandable Spinner Luggage, Red, Carry-on 21-Inch",4.2,203,104.9,"Luggage","False",0
298401,"B0B53B9P29","Hogimcty Garment Bag for Storage and Travel 59 inch for Dance Costume,Wedding Gown,Suit,Garment Bags for Travel and Suit Bag (2 Packs, Pink)",4.7,74,31.94,"Luggage","False",0
298402,"B002G5IFGS","European Carry-On, Saddle, One Size",3.5,11,151.55,"Luggage","False",0
298403,"B0B36ZR8H2","Large Beach Tote Bag for Women Waterproof Shoulder Handbag for Gym Pool Travel Beach",4.9,33,18.88,"Luggage","False",0
298404,"B017M5JE7A","Santorini 20"", 28"" 2pc Expandable Polycarbonate Spinner Set, Navy, One Size",3.8,35,120.15,"Luggage","False",0
298405,"B0BZHVG59J","TOBGB Hi Hi Leaves Tote Bag Spotify Inspired Gift BL Love Gift Comics Lover Gift TV Show Fan Merchandise",0,0,12.89,"Luggage","False",0
298406,"B0BTKTS3WD","ccHuDE Polyester Luggage Cover Washable Suitcase Covers Travel Suitcase Protector Anti Scratch Luggage Proteccor Fits 22"" to 24"" Luggage",0,0,8.99,"Luggage","False",0
298407,"B0CDXGTBZH","Meadows Baby Tote Bag Dark Romance Novels Gift Smut Gift Spicy Book Club Gift Bookish Gift for Her",0,0,15.89,"Luggage","False",0
298408,"B0C8MGYXKB","Carry on Luggage Cover Protector Anti-Scratch Baggage Protective Cover Pink Butterfly Suitcase Cover Fit 18-21 Inch Luggage",4.2,5,13.99,"Luggage","False",0
298409,"B0B7XDWXJJ","Quilted Nylon Weekender, Black/Black/Black-Cognac-White",0,0,46.3,"Luggage","False",0
298410,"B0C3L5YYGN","Carry On Luggage-Airline Approved 22x14x9 Suitcase with Wheels for Travel-TSV Lock, Black, 20 Inch",5,1,49.07,"Luggage","False",0
298411,"B07DWKFNBH","Comp Short Sleeve Batting Jacket",4.6,651,24.95,"Luggage","False",0
298412,"B08M5NSMY7","PP material Hardside Spinner, Carry-On, Wear-resistant, scratch-resistant Suitcase Luggage with Wheels (Black Color, 20-inch)",4.3,88,49.97,"Luggage","False",0
298413,"B0BZCK6MMT","Las Bayadas Beach Bag, Lightweight Colorful Beach Bag",4.6,3,46.49,"Luggage","False",0
298414,"B0BGPN8Y1L","Canvas Tote Bag for Women,Beach Bag,Personalized Canvas Beach Bag,Bride Tote Bag, Bridal Shower Gifts,Bridesmaid Gifts",4.3,21,9.99,"Luggage","False",0
298415,"B0BYZKB2ZG","Waitress Tote Bag Waitress The Musical Tote Waitress Musical Merch Waitress Musical Quote",5,1,16.89,"Luggage","False",0
298420,"B09QLRZD62","Lightweight Travel Bag for Women Carry On Waterproof Duffle Bag with Zipper Tote Bag Large Capacity gym bags",4.7,51,18.99,"Luggage","False",0
298421,"B09F1NK7DC","Camden New Generation Hardside Expandable Spinner Luggage, Navy, 3-Piece Set",3.5,2,180.93,"Luggage","False",0
298422,"B0B766L8P7","Beach Bag Women Large Travel Tote Bag with Cooler Set Waterproof Sandproof Weekend Bag for Family, Pool, Picnic",3.3,22,19.99,"Luggage","False",0
298423,"B08NN6C3PN","Hybrid Garment Bag and Duffel",0,0,650,"Luggage","False",0
298424,"B0BZ16XNRV","Strong Brave Humble Tote Bag for Women Personalized Beach Bag Canvas Bag Inspirational Graduation Gifts for Women Senior College High Nursing Student Friend Sister Birthday",5,1,13.99,"Luggage","False",0
298425,"B0CCB472WB","Bag Strap Replacement for Bogg Bag - 2 PCS Set - 25.66 Inches Length with 4 Rivets - Suitable for X Large Bogg Bag, Rubber Tote Bag, and EVA Bags Beach Bag Repair Kit（Red）",0,0,19.79,"Luggage","False",0
298426,"B098DKKBGY","Rough Enough Large Tote Bag for Women Work Tote Bag for Men with Zipper Camo Cordura",4.7,24,49.99,"Luggage","False",0
298427,"B0C9ZW5JXS","Beach Bag Accessories PVC Rubber Totes Inserts Charms for Bogg Bag",4.7,19,8.99,"Luggage","False",0
298428,"B0BGPF8NLV","Convertible Garment Duffel Bag for Men, 2 In 1 Hanging Travel Garment Bag for Weekender, 45L Suit Bag Gift for Bussiness Trip, Foldable Luggage Carrier Bag, Waterproof Nylon Backpack",4.1,92,36.95,"Luggage","False",0
298429,"B0BV6VQMGP","Weojeviy A Pair Luggage Replacement Wheels, Black Suitcase Mute Single Row Wheel Universal Luggage Replacement Outdoor Supplies",5,1,15.74,"Luggage","False",0
298430,"B0B3DK41B7","Luggage Protector Suitcase Cover PVC Bag Dust Proof Travel Suitcase with A Luggage Handle Wraps By Randomly Sent",3.3,18,8.39,"Luggage","False",0
298431,"B09QC6MCMN","Skyway Epic 2.0 Hardside 4 Wheel Spinner, Lightweight Suitcase, Unisex, Stylish, Bone, Checked-Large 28-Inch",1,1,109.99,"Luggage","False",0
298436,"B0BXRQZXC7","1 Pair Replacement Wheels 360 Swivel Suitcase Casters for Luggage Black (W293)",0,0,13.99,"Luggage","False",0
298437,"B0CG8QZV3Z","Floral Tote Bag for Women, Water Resistant Gym Tote Bags Shoulder Bag Handbag for Travel Work",4.4,564,18.99,"Luggage","False",0
298438,"B0CGHW2PB4","Movie Covers Travel Luggage Protector Suitcases Cover for Boys Trunk Case Washable Covers with Zipper Suitable 18-20inch",0,0,19.99,"Luggage","False",0
298439,"B0BB6F6456","Intergalactic 21"" Upright Luggage, Black",0,0,95.96,"Luggage","False",0
298440,"B001XFBG0Y","Daily Tote with Shoulder Length Handles and Outside Pocket",4.3,1660,9.99,"Luggage","False",0
298441,"B0CB6TGFYH","Butterfly Charms Accessories Compatible with Bogg Bag＆Simply Southern Totes, 5Pcs Colorful Rhinestones Insert Bits Charm",1,3,15.99,"Luggage","False",0
298442,"B09YY7Z43N","Wild Leopard Cheetah Print Luggage Cover Stylish Travel Suitcase Cover for Luggage Protector Stretch&Durable&Washable,L",4,6,22.99,"Luggage","False",0
298443,"B09XQNH5ZW","Hawaiian Palm Ocean Beach Print Travel Luggage Cover Suitcase Cover Protector Anti Scratch Fits 30-32inch Luggage",5,1,23.99,"Luggage","False",0
298444,"B0B5P8K94X","Margaret Sustainably Made Tote",0,0,140,"Luggage","False",0
298445,"B07NJCN9VW","Lakeside Wide Trolley Spinner Luggage with TSA-Lock, Olive Green, Carry-On 20-Inch",3.5,60,85.55,"Luggage","False",0
298446,"B08412N216","Nelson Spinner Suitcase, Black, Carry-On",5,1,117.5,"Luggage","False",0
298447,"B07WDDHFTG","Banpresto - One Piece The Grandline Children Wanokuni Special Ver Shanks Statue",0,0,7.99,"Luggage","False",0
298452,"B00LBH53QM","Camo 5-Piece Spinner Luggage Set, Green, One Size",4.4,58,237.76,"Luggage","False",0
298453,"B09KNDJYXD","37""Kids Costume Garment Bag with 4 Zipper Functional Pockets, Children's Dance Costume Cover Bag, Foldable Travel Storage Cover Bag, Waterproof Clothes Hanging Protector Cover for Travel Competitions",4.3,107,15.58,"Luggage","False",0
298454,"B0C88YZJW9","Carry on Luggage, Expandable Luggage Suitcase, Hardside Luggage with TSA Lock Spinner Wheels YKK zippers, 20in (Sakura Pink)",2,2,89.99,"Luggage","False",0
298455,"B0B5P1HXFQ","Proper Pocket Extenders, Light Grey Jersey Mesh, 7 1/2"" x 7 1/4"", Holds Phone Wallet Keys Everything",0,0,20.99,"Luggage","False",0
298456,"B082RQY599","Lululemon 20th Anniversary Small Reusable Tote Carryall Gym Bag (White/Silver)",2.5,2,24.99,"Luggage","False",0
298457,"B0B1P9J166","Heavy Duty Leak Proof Market Tote (Medium, Geo Camo)",2,1,9.99,"Luggage","False",0
298458,"B07ND1L9N8","By Aline Travel Suitcase Cover With Lycra Spring & Velcro, Small, Orange",4,1,18.99,"Luggage","False",0
298459,"B0C1TGSFSR","Men's Garment Dye S/S Crew",3.7,6,80,"Luggage","False",0
298460,"B0C758LG9V","Le Pliage Club Large Travel Tote Bag, Orange",0,0,234.99,"Luggage","False",0
298461,"B076Y2VG8P","40-Inch Hanging Garment Bag - Multi Owl,One Size",5,1,21,"Luggage","False",0
298462,"B0BR9YS81Z","Silence Lambs Movie Inspired Gift Dr Lecter's Butchery Reusable Canvas Tote Bag Hannibal Lecter Fan Handbag (Dr Lecter's Handbag)",4,1,15.89,"Luggage","False",0
298463,"B0C86LTHXR","Canvas Tote Bag for Women, Birthday Gift Personalized Tote Bag, Initial Tote Bags Bulk for Teacher Friend Beach Wedding",4.5,9,19.99,"Luggage","False",0
298464,"B07P7Q6PF7","Soundbox - Spinner Small Expandable Hand Luggage, 55 cm, 41 liters, Green (Jade Green)",4.8,747,155.77,"Luggage","False",0
298465,"B0B5XJKHNT","Saintrygo 4 Pack Teacher Canvas Tote Bags Teacher Appreciation Gifts Supplies for Women Daycare Teachers (Best Teacher Ever)",4.4,46,13.99,"Luggage","False",0
298466,"B003EZW8IU","Escape 4-Piece Softside Upright Luggage Set, Telescoping Handles, Multi/Pink Dot, (14/19/24/28)",4.2,407,105,"Luggage","False",50
298467,"B0CJ3CMS84","™ Padded Carrying Case for Use with Travel or Big Berkey System (Big Berkey Size)",0,0,74.99,"Luggage","False",0
298468,"B09WZJRQF4","Women's Essential Medium Pouch in Eco-Twill",4.9,14,40,"Luggage","False",0
298469,"B07XB3JFWD","Mizuno Runbird Drawback X",5,9,17,"Luggage","False",0
298470,"B08377ZVV8","Boho Rattan Crochet Straw Woven Basket Bali Handbag - Round Circle Crossbody, Large Shopper Beach Tote Bag",4.4,65,13.95,"Luggage","False",0
298471,"B08JM7MY8Q","RiToEasysports Single Roller Suitcase Wheels,Mute Luggage Wheels Universal Suitcase Replacement Accessory",2.5,4,8.67,"Luggage","False",0
298472,"B07XRS6N5H","Suitcase Wheels, Luggage Swivel Casters Wheels Universal PVC Wheels Luggage Suitcase Trolley",4.1,16,12.86,"Luggage","False",0
298473,"B01JK7H6PA","Albany Softside Lightweight Fashion Spinner Luggage Suitcase (Black, Holdall Bag)",4.4,47,295,"Luggage","False",0
298474,"B0B5TWXZZZ","Cute Cat Luggage Cover for Kids Elastic Suitcase Covers for Travel Washable Baggage Covers Anti-scratch Suitcase Protector for Trunk Case Apply to 22-24 Inch Luggage",5,1,16.99,"Luggage","False",0
298475,"B07BQLT6WH","Madfifennina Washable Spandex Travel Luggage Protector Baggage Suitcase Cover Fit 23-32 Inch (Xl(29""-32"" luggage), Map)",4.2,209,19.99,"Luggage","False",0
298481,"B0CG98D5BP","Custom Canvas Tote Bag Personalized Reusable Carryall Promotional Printed Shoulder bag in Bulk",0,0,3,"Luggage","False",0
298482,"B0C3VHCZJM","Beach Bag for Women, Waterproof Sandproof Beach Tote Bag, Canvas Large Tote Bag with Zipper, Travel Duffle/Pool Bag for women",4.9,25,16.99,"Luggage","False",0
298483,"B0BZJ948HS","BIGCARJOB Rainbow Tie Dye Luggage Handle Wrap for Suitcase,4 Pcs Reusable Luggage Makers Covers Wraps Travel Accessories for Luggage/Suitcase,Women Girls Door Handle Protection Covers",0,0,12.99,"Luggage","False",0
298484,"B0C6JW9MXB","Women's Canvas Tote Zipper Tote With Inner Pocket Shoulder Tote Reusable Travel Beach Shopping Bag Fitness Gift",0,0,14.99,"Luggage","False",0
298485,"B008EHZV5K","Luggage Set, Brown, Set of 3",4.2,891,256.61,"Luggage","False",0
298486,"B000078CYM","X-Small Distressed Nylon Healthy Back Bag Tote",4.6,581,65,"Luggage","False",0
298487,"B0B9BY6R6P","Foldable Travel Duffel Bag For Men Women, Waterproof Lightweight Tote Gym Bag With Wet And Dry Separation Bag, 20-35L Water Resistant Carry On Large Extensible Overnight Weekender Bag",5,2,16.99,"Luggage","False",0
298488,"B0BXSCJM1C","1 Pair Replacement Wheels for Luggage 360 Swivel Suitcase Casters Black with Screwdriver (W055)",0,0,16.99,"Luggage","False",0
298489,"B08CBJLNZM","Karma Gifts, Recycled Medium Gift Bag Daisy",0,0,8.98,"Luggage","False",0
298490,"B0B52HWGGZ","Disney Minnie Mouse 21 Inch Rolling Luggage, Molded Hardshell Carry On Suitcase with Wheels, Gold (FCFL0141-715)",0,0,149.99,"Luggage","False",0
298491,"B0BKC9VTHT","3 Piece Set Impulse Rolling Luggage, Gold Dots Hardshell Suitcase with Spinner Wheels, 22, 26 and 31 Inch, Black",0,0,399.99,"Luggage","False",0
298496,"B0C51QD4X7","4 Wheel Carry-On",0,0,225,"Luggage","False",0
298497,"B0CBRCWK5T","Luckyvestir 3PCS Bogg Bag Charms Bogg Bag Accessories Charm For Tote Bags/Simply Southern Bag Bogg Bits Charms For Beach Bag, Tree&Slipper&Momlife",5,1,11.99,"Luggage","False",0
298498,"B08CBWWN8J","Diablo 2 3/4 SANDNET HS 220G",5,10,9.97,"Luggage","False",0
298499,"B0C4KX2GDZ","Beach Bags Mesh Beach Bag Beach Tote Bags for Women Waterproof Swim Pool Bag with Zipper Insulated Cooler",4.8,11,15.99,"Luggage","False",0
298500,"B0C3L9VT3S","Carry on Luggage-Airline Approved 22x14x9 Suitcase with Wheels for Travel, Red, 20 Inch",4,1,51.72,"Luggage","False",0
298501,"B0CBF3SCYB","Garment Bags for Travel, 2 Pack 43"" Hanging Garment Bags for Men, Double Sides Zipper & 3 Large Mesh Pockets, Garment bag for Traveling Monogrammed Closet Clothes Storage",0,0,28.99,"Luggage","False",0
298502,"B081R9JPLG","Wolf Galaxy Purple Travel Luggage Cover Women Girls Suitcase Protective Case Cushion Protector 26 27 28 29 inch",4.5,4,19.59,"Luggage","False",0
298503,"B0BXWCLJ5K","Canvas Crossbody Bags for Women, Canvas Tote Bag Canvas Purses and Handbags for Womens",4.4,1133,21.99,"Luggage","False",0
298504,"B0BX3V9FVR","Mesh Beach Tote Womens Large Bag with Multiple Pockets Womens Shoulder HandbagVacation Beach Pool Trip Swimming Family",4.6,28,11.99,"Luggage","False",0
298505,"B0B4RNGHNQ","A Pair A65 Suitcase Mute Wheel,Replacement Luggage Wheels, Durable Suitcase Wheels Swivel, Suitcase Wheel with Screw, Universal Luggage Replacement Outdoor Supplies for Repair Replacement [Large]",1,1,17.24,"Luggage","False",0
298506,"B0BWJ72RBH","Canvas Reusable Grocery Bags Heavy Duty, Foldable Large Canvas Tote Bag with Handles, Holds 50 lbs Canvas Shopping Bags",4.7,17,9.99,"Luggage","False",0
298507,"B08YNL7CHT","Totally-Tiffany Nancy EZ20 Tote Bag",5,6,15.74,"Luggage","False",0
